congress,chamber,rollnumber,date,session,clerk_rollnumber,yea_count,nay_count,nominate_mid_1,nominate_mid_2,nominate_spread_1,nominate_spread_2,nominate_log_likelihood,bill_number,vote_result,vote_desc,vote_question,dtl_desc
105,Senate,284,1997-10-29,1,284,100,1,0.0,0.0,0.0,0.0,0.0,PN337,Nomination Confirmed,"William E. Kennard, of California, to be a Member of the Federal Communications Commission for a term of five years from July 1, 1996",On the Nomination,"(SENATE CONFIRMED THE NOMINATION OF WILLIAM E. KENNARD, OF CALIFORNIA, TO BE A MEMBER OF THE FEDERAL COMMUNICATIONS COMMISSION. .)"
105,Senate,285,1997-10-29,1,285,78,20,-0.253,0.932,-0.08,0.14,-47.065,HR1119,Motion to Table Agreed to,"An Act to authorize appropriations for fiscal year 1998 for military activities of the Department of Defense, for military construction, and for defense activities of the Department of Energy, to precribe personnel strengths for such fiscal year for the Armed Forces, and for other purposes.",On the Motion to Table,"(SENATE AGREED TO A MOTION TO TABLE GRAMM MOTION TO POSTPONE THE MOTION TO PROCEED TO CONSIDERATION OF THE CONFERENCE REPORT ON S. 858 UNTIL JANUARY 15, 1998. .)"
105,Senate,286,1997-10-30,1,286,99,0,0.0,0.0,0.0,0.0,0.0,PN455,Nomination Confirmed,"Charles J. Siragusa, of New York, to be United States District Judge for the Western District of New York",On the Nomination,"(SENATE CONFIRMED THE NOMINATION OF CHARLES J. SIRAGUSA, OF NEW YORK, TO BE UNITED STATES DISTRICT JUDGE FOR THE WESTERN DISTRICT OF NEW YORK. .)"
105,Senate,287,1997-10-30,1,287,69,31,-0.648,-0.761,-0.077,0.098,-59.909,S1292,Bill Passed,"A bill disapproving the cancellations transmitted by the President on October 6, 1997, regarding Public Law 105-45.",On Passage of the Bill,"(SENATE PASSED S. 1292, DISAPPROVING THE CANCELLATIONS TRANSMITTED BY THE PRESIDENT ON OCTOBER 6, 1997, REGARDING PUBLIC LAW 105-45. .)"
105,Senate,288,1997-10-31,1,288,56,41,-0.051,0.981,-0.432,0.059,-8.986,HR2646,Cloture Motion Rejected,"A bill to amend the Internal Revenue Code of 1986 to allow tax-free expenditures from education individual retirement accounts for elementary and secondary school expenses, to increase the maximum annual amount of contributions to such accounts, and for other purposes.",On the Cloture Motion,"(THREE-FIFTHS OF THOSE SENATORS DULY CHOSEN AND SWORN NOT HAVING VOTED IN THE AFFIRMATIVE, SENATE FAILED TO CLOSE FURTHER DEBATE ON H.R. 2646. .)"
105,Senate,289,1997-10-31,1,289,93,2,0.0,0.0,0.0,0.0,0.0,HR1119,Cloture Motion Agreed to,"An Act to authorize appropriations for fiscal year 1998 for military activities of the Department of Defense, for military construction, and for defense activities of the Department of Energy, to precribe personnel strengths for such fiscal year for the Armed Forces, and for other purposes.",On the Cloture Motion,"(THREE-FIFTHS OF THOSE SENATORS DULY CHOSEN AND SWORN HAVING VOTED IN THE AFFIRMATIVE, SENATE AGREED TO CLOSE FURTHER DEBATE ON THE MOTION TO PROCEED TO THE CONSIDERATION OF THE CONFERENCE REPORT ON H.R. 1119. .)"
105,Senate,290,1997-11-03,1,290,93,0,0.0,0.0,0.0,0.0,0.0,PN351,Nomination Confirmed,"3 nominations in the Navy beginning with Capt. Howard W. Dawson, Jr. and ending with Capt. Robert R. Percy III",On the Nomination,"(SENATE CONFIRMED THE NOMINATION OF CHARLES ROSSOTTI, OF THE DISTRICT OF COLUMBIA, TO BE COMMISSIONER OF INTERNAL REVENUE. .)"
105,Senate,291,1997-11-04,1,291,56,44,-0.042,0.924,-0.415,0.069,-9.122,HR2646,Cloture Motion Rejected,"A bill to amend the Internal Revenue Code of 1986 to allow tax-free expenditures from education individual retirement accounts for elementary and secondary school expenses, to increase the maximum annual amount of contributions to such accounts, and for other purposes.",On the Cloture Motion,"(THREE-FIFTHS OF THOSE SENATORS DULY CHOSEN AND SWORN NOT HAVING VOTED IN THE AFFIRMATIVE, SENATE FAILED TO CLOSE FURTHER DEBATE H.R. 2646, TO AMEND THE INTERNAL REVENUE CODE OF 1986 TO ALLOW TAX-FREE EXPENDITURES FROM EDUCATION INDIVIDUAL RETIREMENT ACCOUNTS FOR ELEMENTARY AND SECONDARY SCHOOL EXPENSES, AND TO INCREASE THE MAXIMUM ANNUAL AMOUNT OF CONTRIBUTIONS TO SUCH ACCOUNTS. .)"
105,Senate,292,1997-11-04,1,292,69,31,-0.449,-0.894,-0.088,0.052,-56.499,S1269,Cloture on the Motion to Proceed Agreed to,An original bill to establish objectives for negotiating and procedures for implementing certain trade agreements.,On Cloture on the Motion to Proceed,"(THREE-FIFTHS OF THOSE SENATORS DULY CHOSEN AND SWORN HAVING VOTED IN THE AFFIRMATIVE, SENATE AGREED TO A MOTION TO CLOSE FURTHER DEBATE ON THE MOTION TO PROCEED TO CONSIDERATION OF S. 1269. .)"
105,Senate,293,1997-11-05,1,293,101,0,0.0,0.0,0.0,0.0,0.0,PN328,Nomination Confirmed,"Stanley O. Roth, of Virginia, to be an Assistant Secretary of State",On the Nomination,"(SENATE CONFIRMED THE NOMINATION OF JAMES S. GWIN, TO BE UNITED STATES DISTRICT JUDGE FOR THE NORTHERN DISTRICT OF OHIO.)"
105,Senate,294,1997-11-05,1,294,68,31,-0.546,-0.838,-0.107,0.162,-55.551,S1269,Motion to Proceed Agreed to,An original bill to establish objectives for negotiating and procedures for implementing certain trade agreements.,On the Motion to Proceed,(SENATE AGREED TO A MOTION TO PROCEED WITH CONSIDERATION OF S. 1269.)
105,Senate,295,1997-11-06,1,295,99,1,0.0,0.0,0.0,0.0,0.0,PN459,Nomination Confirmed,"Ronald Lee Gilman, of Tennessee, to be United States Circuit Judge for the Sixth Circuit",On the Nomination,"(SENATE CONFIRMED THE NOMINATION OF RONALD LEE GILMAN, OF TENNESSEE, TO BE UNITED STATES CIRCUIT JUDGE FOR THE SIXTH CIRCUIT. .)"
105,Senate,296,1997-11-06,1,296,90,11,-0.672,0.716,-0.191,-0.135,-30.681,HR1119,Conference Report Agreed to,"An Act to authorize appropriations for fiscal year 1998 for military activities of the Department of Defense, for military construction, and for defense activities of the Department of Energy, to precribe personnel strengths for such fiscal year for the Armed Forces, and for other purposes.",On the Conference Report,"(SENATE AGREED TO THE CONFERENCE REPORT ON H.R. 1119, TO AUTHORIZE APPROPRIATIONS FOR FISCAL YEAR 1998 FOR MILITARY ACTIVITIES OF THE DEPARTMENT OF DEFENSE, FOR MILITARY CONSTRUCTION, FOR DEFENSE ACTIVITIES OF THE DEPARTMENT OF ENERGY, AND TO PRESCRIBE PERSONNEL STRENGTHS FOR SUCH FISCAL YEAR FOR THE ARMED FORCES. .)"
105,Senate,297,1997-11-07,1,297,93,6,0.09,0.996,0.127,0.575,-15.946,PN255,Nomination Confirmed,"Vice Admiral Roger T. Rufe, U. S. Coast Guard, to be Commander, Atlantic Area, United States Coast Guard, with the grade of vice admiral while so serving",On the Nomination,"(SENATE CONFIRMED THE NOMINATION OF CHRISTINA A. SNYDER, OF CALIFORNIA, TO BE UNITED STATES DISTRICT JUDGE FOR THE CENTRAL DISTRICT OF CALIFORNIA. .)"
105,Senate,298,1997-11-08,1,298,91,4,0.622,-0.556,0.433,-0.04,-7.56,HR2264,Conference Report Agreed to,"A bill making appropriations for the Departments of Labor, Health and Human Services, and Education, and related agencies for the fiscal year ending September 30, 1998, and for other purposes.",On the Conference Report,"(SENATE AGREED TO THE CONFERENCE REPORT ON H.R. 2264, MAKING APPROPRIATIONS FOR THE DEPARTMENTS OF LABOR, HEALTH AND HUMAN SERVICES, AND EDUCATION, AND RELATED AGENCIES FOR THE FISCAL YEAR ENDING SEPTEMBER 30, 1998. .)"
105,Senate,299,1998-01-28,2,1,68,30,0.359,-0.022,0.212,-0.107,-32.141,PN12,Nomination Confirmed,"Ann L. Aiken, of Oregon, to be United States District Judge for the District of Oregon",On the Nomination,"(SENATE CONFIRMED THE NOMINATION OF ANN L. AIKEN, OF OREGON, TO BE UNITED STATES DISTRICT JUDGE FOR THE DISTRICT OF OREGON. .)"
105,Senate,300,1998-02-03,2,2,97,0,0.0,0.0,0.0,0.0,0.0,PN501,Nomination Confirmed,"Carlos R. Moreno, of California, to be United States District Judge for the Central District of California vice Robert M. Takasugi, retired",On the Nomination,"(SENATE CONFIRMED THE NOMINATION OF CARLOS R. MORENO, OF CALIFORNIA, TO BE UNITED STATES DISTRICT JUDGE FOR THE CENTRAL DISTRICT OF CALIFORNIA. .)"
105,Senate,301,1998-02-03,2,3,97,0,0.0,0.0,0.0,0.0,0.0,PN798,Nomination Confirmed,"Christine O. C. Miller, of the District of Columbia, to be a Judge of the United States Court of Federal Claims for a term of fifteen years",On the Nomination,"(SENATE CONFIRMED THE NOMINATION OF CHRISTINE O. C. MILLER, OF THE DISTRICT OF COLUMBIA, TO BE A JUDGE OF THE UNITED STATES COURT OF FEDERAL CLAIMS FOR A TERM OF FIFTEEN YEARS. .)"
105,Senate,302,1998-02-04,2,4,35,63,-0.189,-0.105,0.236,-0.15,-23.448,S1575,Amendment Rejected,To provide an orderly process for the renaming of existing Federal facilities.,On the Amendment,"(SENATE REJECTED THE ROBB AMENDMENT NO. 1643, TO PROVIDE AN ORDERLY PROCESS FOR THE RENAMING OF EXISTING FEDERAL FACILITIES.)"
105,Senate,303,1998-02-04,2,5,62,36,-0.179,0.984,-0.244,-0.028,-28.072,S1575,Motion to Table Agreed to,"To redesignate the J. Edgar Hoover FBI Building in Washington, District of Columbia, as the ""Federal Bureau of Investigation Building.""",On the Motion to Table,"(SENATE TABLED THE REID AMENDMENT NO. 1640, TO REDESIGNATE THE J. EDGAR HOOVER BUILDING IN WASHINGTON, DISTRICT OF COLUMBIA, AS THE ""FEDERAL BUREAU OF INVESTIGATION BUILDING"". .)"
105,Senate,304,1998-02-04,2,6,35,63,-0.098,0.244,0.174,-0.182,-28.811,S1575,Amendment Rejected,To require approval by the Metropolitan Washington Airports Authority of the renaming of Washington National Airport as the Ronald Reagan National Airport.,On the Amendment,"(SENATE REJECTED THE DASCHLE AMENDMENT NO. 1642, TO REQUIRE THE APPROVAL BY THE METROPOLITAN WASHINGTON AIRPORTS AUTHORITY OF THE RENAMING OF WASHINGTON NATIONAL AIRPORT AS THE RONALD REAGAN  NATIONAL AIRPORT. .)"
105,Senate,305,1998-02-04,2,7,76,22,-0.281,0.138,-0.228,0.264,-29.255,S1575,Bill Passed,"A bill to rename the Washington National Airport located in the District of Columbia and Virginia as the ""Ronald Reagan Washington National Airport"".",On Passage of the Bill,"(SENATE PASSED S. 1575, TO RENAME THE WASHINGTON NATIONAL AIRPORT LOCATED IN THE DISTRICT OF COLUMBIA AND VIRGINIA AS THE ""RONALD REAGAN WASHINGTON NATIONAL AIRPORT"". .)"
105,Senate,306,1998-02-10,2,8,75,23,0.214,0.767,0.217,0.294,-28.716,PN623,Cloture on the Motion to Proceed Agreed to,"David Satcher, of Tennessee, to be Medical Director in the Regular Corps of the Public Health Service, subject to qualifications therefor as provided by law and regulations, and to be Surgeon General of the Public Health Service for a term of four years",On Cloture on the Motion to Proceed,"(THREE-FIFTHS OF THOSE SENATORS DULY CHOSEN AND SWORN HAVING VOTED IN THE AFFIRMATIVE, SENATE AGREED TO CLOSE FURTHER DEBATE ON THE NOMINATION.)"
105,Senate,307,1998-02-10,2,9,64,35,0.263,0.105,0.24,0.166,-26.028,PN623,Nomination Confirmed,"David Satcher, of Tennessee, to be Medical Director in the Regular Corps of the Public Health Service, subject to qualifications therefor as provided by law and regulations, and to be Surgeon General of the Public Health Service for a term of four years",On the Nomination,"(SENATE CONFIRMED THE NOMINATION OF DAVID SATCHER, OF TENNESSEE, TO BE ASSISTANT SECRETARY OF HEALTH AND HUMAN SERVICES, TO BE MEDICAL DIRECTOR IN THE REGULAR CORPS OF THE PUBLIC HEALTH SERVICE, AND TO BE SURGEON GENERAL OF THE UNITED STATES.)"
105,Senate,308,1998-02-11,2,10,42,54,0.239,-0.103,-0.305,0.049,-18.138,S1601,Cloture Motion Rejected,"A bill to amend title 18, United States Code, to prohibit the use of somatic cell nuclear transfer technology for purposes of human cloning.",On the Cloture Motion,"(THREE-FIFTHS OF THOSE SENATORS DULY CHOSEN AND SWORN, NOT HAVING VOTED IN THE AFFIRMATIVE, SENATE REJECTED A MOTION TO CLOSE FURTHER DEBATE ON THE MOTION TO PROCEED TO CONSIDERATION OF S. 1601.)"
105,Senate,309,1998-02-11,2,11,68,28,0.383,-0.286,0.233,0.117,-26.94,PN20,Nomination Confirmed,"Margaret M. Morrow, of California, to be United States District Judge for the Central District of California vice Richard A. Gadbois, retired",On the Nomination,"(SENATE CONFIRMED THE NOMINATION OF MARGARET M. MORROW, OF CALIFORNIA, TO BE UNITED STATES DISTRICT JUDGE FOR THE CENTRAL DISTRICT OF CALIFORNIA.)"
105,Senate,310,1998-02-24,2,12,48,51,-0.061,0.597,-0.617,-0.829,-8.465,S1663,Motion to Table Failed,To provide a complete substitute to reform the financing of Federal elections.,On the Motion to Table,"(SENATE FAILED TO TABLE MCCAIN AMENDMENT NO. 1646, IN THE NATURE OF A SUBSTITUTE.)"
105,Senate,311,1998-02-25,2,13,79,20,-0.645,-0.017,-0.091,-0.134,-48.912,HR2631,Veto Overridden,"A bill disapproving the cancellations transmitted by the President on October 6, 1997, regarding Public Law 105-45.",On Overriding the Veto,"(TWO-THIRDS OF SENATORS VOTING HAVING VOTED IN THE AFFIRMATIVE, SENATE VOTED TO OVERRIDE THE PRESIDENT'S VETO OF H.R. 2631, DISAPPROVING THE CANCELLATIONS TRANSMITTED BY THE PRESIDENT ON OCTOBER 6, 1997, REGARDING PUBLIC LAW 105-45. .)"
105,Senate,312,1998-02-25,2,14,47,50,-0.03,0.506,-0.584,-0.832,-9.896,S1663,Motion to Table Failed,Relating to electioneering communications.,On the Motion to Table,"(SENATE FAILED TO TABLE THE SNOWE AMENDMENT NO. 1647, AMENDING THOSE PROVISIONS WITH RESPECT TO COMMUNICATIONS MADE DURING ELECTIONS, INCLUDING COMMUNICATIONS MADE BY INDEPENDENT ORGANIZATIONS. .)"
105,Senate,313,1998-02-25,2,15,48,50,-0.059,0.586,-0.635,-0.854,-8.466,S1663,Motion to Table Failed,To provide a complete substitute to reform the financing of Federal elections.,On the Motion to Table,"(SENATE FAILED TO TABLE THE MCCAIN AMENDMENT NO. 1646, IN THE NATURE OF A SUBSTITUTE.)"
105,Senate,314,1998-02-26,2,16,51,48,-0.061,0.597,0.617,0.829,-8.465,S1663,Cloture Motion Rejected,To provide a complete substitute to reform the financing of Federal elections.,On the Cloture Motion,"(THREE FIFTHS OF THOSE SENATORS DULY CHOSEN AND SWORN NOT HAVING VOTED IN THE AFFIRMATIVE, SENATE FAILED TO CLOSE FURTHER DEBATE ON THE MCCAIN AMENDMENT NO. 1646, IN THE NATURE OF A SUBSTITUTE, AMENDED.)"
105,Senate,315,1998-02-26,2,17,45,54,0.128,0.163,-0.484,-0.527,-11.058,S1663,Cloture Motion Rejected,A bill to protect individuals from having their money involuntarily collected and used for politics by a corporation or labor organization.,On the Cloture Motion,"(THREE FIFTHS OF THOSE SENATORS DULY CHOSEN AND SWORN HAVING NOT VOTED IN THE AFFIRMATIVE, SENATE FAILED TO CLOSE FURTHER DEBATE ON THE BILL.)"
105,Senate,316,1998-03-02,2,18,82,0,0.0,0.0,0.0,0.0,0.0,PN456,Nomination Confirmed,"Richard L. Young, of Indiana, to be United States District Judge for the Southern District of Indiana",On the Nomination,"(SENATE CONFIRMED THE NOMINATION OF RICHARD L. YOUNG, OF INDIANA, TO BE UNITED STATES DISTRICT JUDGE FOR THE SOUTHERN DISTRICT OF INDIANA.)"
105,Senate,317,1998-03-03,2,19,54,43,0.084,0.957,-0.328,0.161,-11.185,S1173,Motion to Table Agreed to,To require the Secretary of Health and Human Services to report on the number of former recipients of public assistance under the State temporary assistance to needy families programs that are economically self-sufficient.,On the Motion to Table,"(SENATE TABLED WELLSTONE AMENDMENT 1679 TO AMENDMENT NO. 1676, TO REQUIRE A REPORT ON THE NUMBER OF FORMER RECIPIENTS OF PUBLIC ASSISTANCE UNDER THE STATE TEMPORARY ASSISTANCE TO NEEDY FAMILIES PROGRAMS THAT ARE ECONOMICALLY SELF-SUFFICIENT.)"
105,Senate,318,1998-03-04,2,20,63,32,0.387,-0.922,0.12,0.032,-46.719,S1173,Amendment Agreed to,To provide for a national standard to prohibit the operation of motor vehicles by intoxicated individuals.,On the Amendment,"(SENATE AGREED TO THE LAUTENBERG AMENDMENT NO. 1682 TO AMENDMENT NO. 1676, TO PROHIBIT THE POSSESSION OF ANY OPEN ALCOHOLIC BEVERAGE CONTAINER, OR THE CONSUMPTION OF ANY ALCOHOLIC BEVERAGE, IN THE PASSENGER AREA OF A VEHICLE ON A PUBLIC HIGHWAY.)"
105,Senate,319,1998-03-05,2,21,52,47,-0.18,0.984,0.148,0.179,-43.519,S1173,Amendment Agreed to,To withhold certain Federal highway funds from a State that fails to prohibit open containers of alcoholic beverages and consumption of alcoholic beverages in the passenger area of motor vehicles.,On the Amendment,"(SENATE AGREED TO DORGAN AMENDMENT NO. 1697 TO AMENDMENT NO. 1676, TO ENCOURAGE STATES TO ENACT LAWS THAT BAN THE SALE OF ALCOHOL THROUGH DRIVE-UP OR DRIVE THROUGH SALES WINDOW.)"
105,Senate,320,1998-03-05,2,22,43,56,-0.177,0.981,0.151,0.084,-44.546,S1173,Amendment Rejected,To encourage States to enact laws that ban the sale of alcohol through a drive-up or drive-through sales window.,On the Amendment,"(SENATE REJECTED THE BINGAMAN/BYRD MODIFIED AMENDMENT NO. 1696 TO AMENDMENT NO. 1676, TO ENCOURAGE STATES TO ENACT LAWS THAT BAN THE SALE OF ALCOHOL THROUGH A DRIVE-UP OR DRIVE-THROUGH SALES WINDOW.)"
105,Senate,321,1998-03-06,2,23,59,37,0.36,-0.933,0.315,0.258,-20.736,S1173,Motion to Table Agreed to,"To require that Federal surface transportation funds be used to encourage development and outreach to emerging business enterprises, including those owned by minorities and women, and to prohibit discrimination and preferential treatment based on race, color, national origin, or sex, with respect to use of those funds, in compliance with the equal protection provisions of the fifth and 14th amendments to the Constitiution.",On the Motion to Table,"(SENATE TABLED MCCONNELL AMENDMENT NO. 1708 TO AMENDMENT NO. 1676, TO REQUIRE THAT FEDERAL SURFACE TRANSPORTATION FUNDS BE USED TO ENCOURAGE DEVELOPMENT AND OUTREACH TO EMERGING BUSINESS ENTERPRISES, INCLUDING THOSE OWNED BY MINORITIES AND WOMEN, AND TO PROHIBIT DISCRIMINATION AND PREFERENTIAL TREATMENT BASED ON RACE, COLOR, NATIONAL ORIGIN, OR SEX, WITH RESPECT TO USE OF THOSE FUNDS, IN COMPLIANCE WITH EQUAL PROTECTION PROVISIONS OF THE FIFTH AND 14TH AMENDMENTS TO THE CONSTITUTION.)"
105,Senate,322,1998-03-09,2,24,93,2,0.0,0.0,0.0,0.0,0.0,S1668,Bill Passed,An original bill to encourage the disclosure to Congress of certain classified and related information.,On Passage of the Bill,"(SENATE PASSED S. 1668, TO ENCOURAGE THE DISCLOSURE TO CONGRESS OF CERTAIN CLASSIFIED AND RELATED INFORMATION.)"
105,Senate,323,1998-03-10,2,25,96,4,0.657,0.153,0.407,-0.251,-9.877,S1173,Amendment Agreed to,"To reauthorize the mass transit programs of the Federal Government, and for other purposes.",On the Amendment,"(SENATE AGREED TO THE D'AMATO MODIFIED AMENDMENT NO. 1931, TO AMENDMENT NO. 1676, TO REAUTHORIZE THE MASS TRANSIT PROGRAMS OF THE FEDERAL GOVERNMENT.)"
105,Senate,324,1998-03-11,2,26,18,80,0.427,-0.577,-0.129,0.191,-36.699,S1173,Motion Rejected,"To repeal the 4.3-cent transportation motor fuels excise tax transferred to the Highway Trust Fund by the Taxpayer Relief Act of 1997, effective on the date of enactment of this Act.",On the Motion,"(THREE-FIFTHS OF THOSE SENATORS DULY CHOSEN AND SWORN NOT HAVING VOTED IN THE AFFIRMATIVE, SENATE REJECTED A MOTION TO WAIVE SECTION 311(A)(2)(B) OF THE CONGRESSIONAL BUDGET ACT OF 1974 WITH RESPECT TO THE CONSIDERATION OF MACK AMENDMENT NO. 1906, TO AMENDMENT NO. 1963, TO REPEAL THE 4.3-CENT TRANSPORTATION MOTOR FUELS EXCISE TAX.)"
105,Senate,325,1998-03-11,2,27,71,26,0.651,-0.11,0.08,-0.341,-51.632,S1173,Motion to Table Agreed to,To prohibit extension of inequitable ethanol subsidies.,On the Motion to Table,"(SENATE TABLED MCCAIN AMENDMENT NO. 1968, TO AMENDMENT NO. 1963, TO PROHIBIT EXTENSION OF INEQUITABLE ETHANOL SUBSIDIES.)"
105,Senate,326,1998-03-11,2,28,96,3,0.892,0.112,0.504,-1.39,-9.747,S1173,Cloture Motion Agreed to,To provide a complete substitute.,On the Cloture Motion,"(THREE-FIFTHS OF THOSE SENATORS DULY CHOSEN AND SWORN HAVING VOTED IN THE AFFIRMATIVE, SENATE AGREED TO CLOSE FURTHER DEBATE ON THE CHAFEE MODIFIED AMENDMENT NO. 1676, IN THE NATURE OF A SUBSTITUTE. .)"
105,Senate,327,1998-03-12,2,29,78,22,-0.378,-0.487,-0.127,-0.006,-43.017,S1173,Amendment Agreed to,To provide that demonstration projects shall be subject to any limitation on obligations established by law that applies to Federal-aid highways and highway safety construction programs.,On the Amendment,"(SENATE AGREED TO MCCAIN AMENDMENT NO. 1726 TO AMENDMENT NO. 1676, TO PROVIDE THAT DEMONSTRATION PROJECTS SHALL BE SUBJECT TO ANY LIMITATION ON OBLIGATIONS ESTABLISHED BY LAW THAT APPLIES IN FEDERAL-AID HIGHWAYS AND HIGHWAY SAFETY CONSTRUCTION PROGRAMS.)"
105,Senate,328,1998-03-12,2,30,96,4,-0.22,-0.971,-0.047,-0.666,-14.014,S1173,Amendment Agreed to,To provide a complete substitute.,On the Amendment,"(SENATE AGREED TO CHAFEE AMENDMENT NO. 1676, MODIFIED COMMITTEE AMENDMENT IN THE NATURE OF A SUBSTITUTE.)"
105,Senate,329,1998-03-12,2,31,95,5,-0.751,0.66,-0.192,-0.018,-20.635,SRES187,Resolution Agreed to,A resolution expressing the sense of the Senate regarding the human rights situation in the People's Republic of China.,On the Resolution,"(SENATE PASSED S.RES. 187, EXPRESSING THE SENSE OF THE SENATE REGARDING THE HUMAN RIGHTS SITUATION IN THE PEOPLE'S REPUBLIC OF CHINA.)"
105,Senate,330,1998-03-13,2,32,93,0,0.0,0.0,0.0,0.0,0.0,SCONRES78,Concurrent Resolution Agreed to,A concurrent resolution relating to the indictment and prosecution of Saddam Hussein for war crimes and other crimes against humanity.,On the Concurrent Resolution,"(SENATE PASSED S.CON.RES. 78, RELATING TO THE INDICTMENT AND PROSECUTION OF SADDAM HUSSEIN FOR WAR CRIMES AND OTHER CRIMES AGAINST HUMANITY.)"
105,Senate,331,1998-03-16,2,33,91,0,0.0,0.0,0.0,0.0,0.0,PN610,Nomination Confirmed,"Jeremy D. Fogel, of California, to be United States District Judge for the Northern District of California",On the Nomination,"(SENATE CONFIRMED THE NOMINATION OF JEREMY D. FOGEL, OF CALIFORNIA, TO BE UNITED STATES DISTRICT JUDGE FOR THE NORTHERN DISTRICT OF CALIFORNIA.)"
105,Senate,332,1998-03-17,2,34,74,24,-0.298,-0.686,-0.253,0.012,-28.557,HR2646,Cloture Motion Agreed to,"A bill to amend the Internal Revenue Code of 1986 to allow tax-free expenditures from education individual retirement accounts for elementary and secondary school expenses, to increase the maximum annual amount of contributions to such accounts, and for other purposes.",On the Cloture Motion,"(THREE-FIFTHS OF THOSE SENATORS DULY CHOSEN AND SWORN HAVING VOTED IN THE AFFIRMATIVE, SENATE AGREED TO CLOSE FURTHER DEBATE ON THE MOTION TO PROCEED TO CONSIDERATION OF H.R. 2646, TO AMEND THE INTERNAL REVENUE CODE OF 1986 TO ALLOW TAX-FREE EXPENDITURES FROM EDUCATION INDIVIDUAL RETIREMENT ACCOUNTS FOR ELEMENTARY AND SECONDARY SCHOOL EXPENSES, AND TO INCREASE THE MAXIMUM ANNUAL AMOUNT OF CONTRIBUTIONS TO SUCH ACCOUNTS.)"
105,Senate,333,1998-03-17,2,35,99,0,0.0,0.0,0.0,0.0,0.0,PN481,Nomination Confirmed,"Susan Graber, of Oregon, to be United States Circuit Judge for the Ninth Circuit",On the Nomination,"(SENATE CONFIRMED THE NOMINATION OF SUSAN GRABER, OF OREGON, TO BE UNITED STATES CIRCUT JUDGE FOR THE NINTH CIRCUT.)"
105,Senate,334,1998-03-18,2,36,55,44,-0.044,-0.27,-0.678,0.698,-0.286,TREATYDOC10536,Motion to Proceed Agreed to,"Protocols to the North Atlantic Treaty of 1949 on the accession of Poland, Hungary, and the Czech Republic. These protocols were opened for signature at Brussels on December 16, 1997, and signed on behalf of the United States of America and other parties to the North Atlantic Treaty",On the Motion to Proceed,(SENATE AGREED TO A MOTION TO PROCEED TO EXECUTIVE SESSION TO RESUME CONSIDERATION OF THE TREATY. .)
105,Senate,335,1998-03-18,2,37,98,0,0.0,0.0,0.0,0.0,0.0,SCONRES85,Concurrent Resolution Agreed to,A concurrent resolution calling for an end to the violent repression of the people of Kosovo.,On the Concurrent Resolution,"(SENATE PASSED S. CON. RES.85, CALLING FOR AN END TO THE VIOLENT REPRESSION OF THE PEOPLE OF KOSOVO.)"
105,Senate,336,1998-03-19,2,38,55,44,-0.04,-0.239,-0.669,0.687,-0.286,HR2646,Cloture Motion Rejected,"A bill to amend the Internal Revenue Code of 1986 to allow tax-free expenditures from education individual retirement accounts for elementary and secondary school expenses, to increase the maximum annual amount of contributions to such accounts, and for other purposes.",On the Cloture Motion,"(THREE-FIFTHS OF THOSE SENATORS DULY CHOSEN AND SWORN NOT HAVING VOTED IN THE AFFIRMATIVE, SENATE FAILED TO CLOSE FURTHER DEBATE ON H.R. 2646, TO AMEND THE INTERNAL REVENUE CODE OF 1986 TO ALLOW TAX-FREE EXPENDITURES FROM EDUCATION INDIVIDUAL RETIREMENT ACCOUNTS FOR ELEMENTARY AND SECONDARY SCHOOL EXPENSES, TO INCREASE THE MAXIMUM ANNUAL AMOUNT OF CONTRIBUTIONS TO SUCH ACCOUNTS, AND FOR OTHER PURPOSES.)"
105,Senate,337,1998-03-23,2,39,61,31,0.794,0.568,0.125,-0.336,-51.328,S1768,Motion to Table Agreed to,"To eliminate unrelated, wasteful, and unnecessary spending items from the bill.",On the Motion to Table,"(SENATE REJECTED MCCAIN AMENDMENT NO. 2063, TO ELIMINATE CERTAIN SPENDING ITEMS FROM THE BILL.  .)"
105,Senate,338,1998-03-24,2,40,76,24,0.556,0.831,0.234,-0.171,-34.813,S1768,Motion to Table Agreed to,"To ensure that the surplus in fiscal years 1999 through 2003, proposed by the President to be dedicated to save Social Security, will not be lowered by the enactment of this Act.",On the Motion to Table,"(SENATE REJECTED GRAMM/SANTORUM AMENDMENT NO. 2104, TO ESTABLISH THAT ONLY THAT PORTION OF BUDGET AUTHORITY PROVIDED IN THIS ACT THAT IS OBLIGATED DURING FISCAL YEAR 1998 SHALL BE DESIGNATED AS AN EMERGENCY REQUIREMENT PURSUANT TO THE BALANCED BUDGET AND EMERGENCY DEFICIT CONTROL ACT OF 1985. .)"
105,Senate,339,1998-03-25,2,41,92,8,-0.71,-0.686,-0.113,-0.321,-26.59,S1768,Motion to Table Agreed to,To remove the emergency designation for the supplemental appropriations to fund incremental costs of contingency operations in Bosnia.,On the Motion to Table,"(SENATE TABLED FEINGOLD AMENDMENT NO. 2121, TO REMOVE THE EMERGENCY DESIGNATION FOR THE SUPPLEMENTAL APPROPRIATIONS TO FUND INCREMENTAL COSTS OF CONTINGENCY OPERATIONS IN BOSNIA.)"
