congress,chamber,rollnumber,date,session,clerk_rollnumber,yea_count,nay_count,nominate_mid_1,nominate_mid_2,nominate_spread_1,nominate_spread_2,nominate_log_likelihood,bill_number,vote_result,vote_desc,vote_question,dtl_desc
105,Senate,451,1998-06-10,2,153,43,55,-0.116,-0.601,0.715,0.024,-6.742,S1415,Cloture Motion Rejected,"A bill to reform and restructure the processes by which tobacco products are manufactured, marketed, and distributed, to prevent the use of tobacco products by minors, to redress the adverse health effects of tobacco use, and for other purposes.",On the Cloture Motion,"(THREE-FIFTHS OF THOSE SENATORS DULY CHOSEN AND SWORN NOT HAVING VOTED IN THE AFFIRMATIVE, SENATE FAILED TO AGREE TO CLOSE FURTHER DEBATE ON THE MODIFIED COMMITTEE AMENDMENT IN THE NATURE OF A SUBSTITUTE.)"
105,Senate,452,1998-06-10,2,154,48,50,0.037,0.046,0.317,0.409,-11.344,S1415,Motion to Table Failed,"To eliminate the marriage penalty reflected in the standard deduction, to ensure the earned income credit takes into account the elimination of such penalty, and to provide a full deduction for health insurance costs of self-employed individuals.",On the Motion to Table,"(SENATE FAILED TO TABLE GRAMM MODIFIED AMENDMENT NO. 2686 TO AMENDMENT NO. 2437, TO ELIMINATE THE MARRIAGE PENALTY REFLECTED IN THE STANDARD DEDUCTION, TO ENSURE THE EARNED INCOME CREDIT TAKES INTO ACCOUNT THE ELIMINATION OF SUCH PENALTY, AND TO PROVIDE A FULL DEDUCTION FOR HEALTH INSURANCE COSTS OF SELF-EMPLOYED INDIVIDUALS.)"
105,Senate,453,1998-06-10,2,155,55,43,-0.051,-0.193,-0.583,1.189,-1.507,S1415,Motion to Table Agreed to,"To provide a deduction for two-earner married couples, to allow self employed individuals a 100-percent deduction for health insurance costs, and for other purposes.",On the Motion to Table,"(SENATE TABLED DASCHLE AMENDMENT NO. 2688 TO AMENDMENT NO. 2437, TO PROVIDE A DEDUCTION FOR TWO-EARNER MARRIED COUPLES, AND TO ALLOW SELF-EMPLOYED INDIVIDUALS A 100-PERCENT DEDUCTION FOR HEALTH CARE INSURANCE COSTS.)"
105,Senate,454,1998-06-11,2,156,43,56,-0.119,-0.38,0.736,0.052,-6.877,S1415,Cloture Motion Rejected,"A bill to reform and restructure the processes by which tobacco products are manufactured, marketed, and distributed, to prevent the use of tobacco products by minors, to redress the adverse health effects of tobacco use, and for other purposes.",On the Cloture Motion,"(THREE-FIFTHS OF THOSE SENATORS DULY CHOSEN AND SWORN NOT HAVING VOTED IN THE AFFIRMATIVE, SENATE FAILED TO AGREE TO CLOSE FURTHER DEBATE ON THE MODIFIED COMMITTEE AMENDMENT IN THE NATURE OF A SUBSTITUTE. .)"
105,Senate,455,1998-06-11,2,157,33,66,0.31,-0.262,-0.367,0.489,-25.084,S1415,Motion to Table Failed,To clarify Commmerce Committee intent regarding state strings.,On the Motion to Table,"(SENATE FAILED TO TABLE THE KERRY MODIFIED AMENDMENT NO. 2689 TO AMENDMENT NO. 2437, TO ESTABLISH THAT A STATE SHALL USE NOT LESS THAN 50 PERCENT OF CERTAIN RESTRICTED FUNDS TO CARRY OUT ACTIVITIES UNDER THE CHILD CARE AND DEVELOPMENT BLOCK GRANT ACT OF 1990. .)"
105,Senate,456,1998-06-11,2,158,50,45,0.122,-0.415,0.135,-0.034,-37.14,S1415,Motion to Table Agreed to,To limit attorneys' fees.,On the Motion to Table,"(SENATE TABLED THE FAIRCLOTH AMENDMENT NO. 2701 TO AMENDMENT NO. 2437, TO LIMIT ATTORNEYS' FEES. .)"
105,Senate,457,1998-06-15,2,159,47,47,0.07,-0.025,-0.161,-0.099,-29.049,S1415,Motion to Table Failed,"To disallow tax deductions for advertising, promotional, and marketing expenses relating to tobacco product use unless certain requirements are met.",On the Motion to Table,"(SENATE FAILED TO TABLE THE REED AMENDMENT NO. 2702 TO AMENDMENT NO. 2437, TO DISALLOW TAX DEDUCTIONS FOR ADVERTISING, PROMOTIONAL, AND MARKETING EXPENSES RELATING TO TOBACCO PRODUCT USE UNLESS CERTAIN REQUIREMENTS ARE MET. .)"
105,Senate,458,1998-06-16,2,160,49,48,-0.007,-0.792,-0.16,0.096,-32.433,S1415,Amendment Agreed to,To limit attorneys' fees.,On the Amendment,"(SENATE AGREED TO THE GORTON AMENDMENT NO. 2705, TO LIMIT ATTORNEYS' FEES.)"
105,Senate,459,1998-06-17,2,161,58,42,0.234,-0.267,0.218,0.356,-25.843,S1415,Cloture Motion Rejected,"A bill to reform and restructure the processes by which tobacco products are manufactured, marketed, and distributed, to prevent the use of tobacco products by minors, to redress the adverse health effects of tobacco use, and for other purposes.",On the Cloture Motion,"(THREE-FIFTHS OF THOSE SENATORS DULY CHOSEN AND SWORN NOT HAVING VOTED IN THE AFFIRMATIVE, SENATE FAILED TO CLOSE FURTHER DEBATE ON THE MODIFIED COMMITTEE AMENDMENT IN THE NATURE OF A SUBSTITUTE. .)"
105,Senate,460,1998-06-17,2,162,54,46,0.275,-0.53,0.255,0.45,-23.242,S1415,Motion Rejected,"A bill to reform and restructure the processes by which tobacco products are manufactured, marketed, and distributed, to prevent the use of tobacco products by minors, to redress the adverse health effects of tobacco use, and for other purposes.",On the Motion,"(THREE-FIFTHS OF THOSE SENATORS DULY CHOSEN AND SWORN NOT HAVING VOTED IN THE AFFIRMATIVE, SENATE REJECTED A MOTION TO WAIVE THE CONGRESSIONAL BUDGET ACT OF 1974 WITH RESPECT TO CONSIDERATION OF S. 1415, UNIVERSAL TOBACCO SETTLEMENT ACT. .)"
105,Senate,461,1998-06-18,2,163,96,2,0.0,0.0,0.0,0.0,0.0,S2138,Motion for Attendance Agreed to,"An original bill making appropriations for energy and water development for the fiscal year ending September 30, 1999, and for other purposes.",On the Motion for Attendance,(SENATE AGREED TO A MOTION TO INSTRUCT THE SERGEANT AT ARMS TO REQUEST THE ATTENDANCE OF ABSENT SENATORS. .)
105,Senate,462,1998-06-18,2,164,54,44,-0.079,-0.997,-0.562,0.026,-4.866,S2138,Motion to Table Agreed to,"An original bill making appropriations for energy and water development for the fiscal year ending September 30, 1999, and for other purposes.",On the Motion to Table,"(SENATE TABLED A MOTION TO WAIVE THE CONGRESSIONAL BUDGET ACT OF 1974 WITH RESPECT TO CONSIDERATION OF DASCHLE AMENDMENT NO. 2714, TO REFORM AND STRUCTURE THE PROCESSES BY WHICH TOBACCO PRODUCTS ARE MANUFACTURED, MARKETED, AND DISTRIBUTED, TO PREVENT THE USE OF TOBACCO PRODUCTS BY MINORS, AND TO REDRESS THE ADVERSE HEALTH EFFECTS OF TOBACCO USE. .)"
105,Senate,463,1998-06-18,2,165,98,1,0.0,0.0,0.0,0.0,0.0,S2138,Bill Passed,"An original bill making appropriations for energy and water development for the fiscal year ending September 30, 1999, and for other purposes.",On Passage of the Bill,"(SENATE PASSED S. 2138, MAKING APPROPRIATIONS FOR ENERGY AND WATER DEVELOPMENT FOR THE FISCAL YEAR ENDING SEPTEMBER 30, 1999. .)"
105,Senate,464,1998-06-22,2,166,57,34,0.149,0.317,0.345,0.531,-16.54,PN19,Nomination Confirmed,"Susan Oki Mollway, of Hawaii, to be United States District Judge for the District of Hawaii vice Harold M. Fong, deceased",On the Nomination,"(SENATE CONFIRMED THE NOMINATION OF SUSAN OKI MOLLWAY, OF HAWAII, TO BE UNITED STATES DISTRICT JUDGE, CENTRAL DISTRICT, HAWAII.)"
105,Senate,465,1998-06-23,2,167,14,82,0.8,0.286,-0.163,0.366,-40.395,S2057,Motion to Table Failed,Condemning Human Rights abuses in the People's Republic of China.,On the Motion to Table,"(SENATE FAILED TO TABLE THE WARNER MODIFIED AMENDMENT NO. 2737 TO AMENDMENT NO. 2736, CONDEMNING HUMAN RIGHTS ABUSES IN THE PEOPLE'S REPUBLIC OF CHINA.  .)"
105,Senate,466,1998-06-23,2,168,0,96,0.0,0.0,0.0,0.0,0.0,S2057,Motion to Table Failed,Condemning Human Rights abuses in the People's Republic of China.,On the Motion to Table,"(SENATE FAILED TO TABLE DIVISION I OF AMENDMENT NO. 2737, TO CONDEMN THOSE OFFICIALS OF THE CHINESE COMMUNIST PARTY, THE GOVERNMENT OF THE PEOPLE'S REPUBLIC OF CHINA, AND OTHER PERSONS WHO ARE INVOLVED IN THE ENFORCEMENT OF FORCED ABORTIONS BY PREVENTING SUCH PERSONS FROM ENTERING OR REMAINING IN THE UNITED STATES.)"
105,Senate,467,1998-06-24,2,169,59,37,-0.196,0.385,-0.277,-0.173,-20.428,HR2646,Conference Report Agreed to,"A bill to amend the Internal Revenue Code of 1986 to allow tax-free expenditures from education individual retirement accounts for elementary and secondary school expenses, to increase the maximum annual amount of contributions to such accounts, and for other purposes.",On the Conference Report,"(SENATE AGREED TO THE CONFERENCE REPORT ON H.R. 2646, TO AMEND THE INTERNAL REVENUE CODE OF 1986 TO ALLOW TAX-FREE EXPENDITURES FROM EDUCATION INDIVIDUAL RETIREMENT ACCOUNTS FOR ELEMENTARY AND SECONDARY SCHOOL EXPENSES, AND TO INCREASE THE MAXIMUM ANNUAL AMOUNT OF CONTRIBUTIONS TO SUCH ACCOUNTS, CLEARING THE MEASURE FOR THE PRESIDENT.)"
105,Senate,468,1998-06-24,2,170,90,5,-0.36,0.933,-0.175,0.25,-19.501,S2057,Amendment Agreed to,To express the sense of Congress regarding continued participation of United States forces in operations in Bosnia and Herzegovina.,On the Amendment,"(SENATE AGREED TO THURMOND AMENDMENT NO. 2975, TO EXPRESS THE SENSE OF CONGRESS REGARDING CONTINUED PARTICIPATION OF UNITED STATES FORCES IN OPERATIONS IN BOSNIA AND HERZEGOVINA.)"
105,Senate,469,1998-06-24,2,171,65,31,0.378,0.926,0.184,-0.024,-38.561,S2057,Motion to Table Agreed to,"To limit the use of funds to support the continued deployment of ground combat forces of the Armed Forces of the United States in Bosnia and Herzegovina pending a vote of Congress on the continuation of the deployment, and to require the President to submit Congress a plan for withdrawing United States forces from Bosnia and Herzegovina if Congress does not so act by March 31, 1999.",On the Motion to Table,"(SENATE TABLED SMITH OF NEW HAMPSHIRE MODIFIED AMENDMENT NO. 2912, TO LIMIT THE USE OF FUNDS TO SUPPORT THE CONTINUED DEPLOYMENT OF GROUND COMBAT FORCES OF THE ARMED FORCES OF THE UNITED STATES IN BOSNIA AND HERZEGOVINA PENDING A VOTE OF CONGRESS ON THE CONTINUATION OF THE DEPLOYMENT, AND TO REQUIRE THE PRESIDENT TO SUBMIT TO CONGRESS A PLAN FOR WITHDRAWING UNITED STATES FORCES FROM BOSNIA AND HERZEGOVINA IF CONGRESS DOES NOT SO ACT BY MARCH 31, 1999. .)"
105,Senate,470,1998-06-24,2,172,56,37,0.45,-0.867,0.22,0.315,-33.009,S2057,Amendment Agreed to,To require a moratorium on changes to gender related policies and practices.,On the Amendment,"(SENATE AGREED TO SNOWE AMENDMENT NO. 2979 TO AMENDMENT NO. 2978, TO REQUIRE A MORATORIUM ON CHANGES TO GENDER-RELATED POLICIES AND PRACTICES. .)"
105,Senate,471,1998-06-25,2,173,18,74,-0.025,-1.0,0.201,0.448,-22.609,S2057,Amendment Rejected,"To provide with an offset, $270,000,000 for the Child Development Program of the Department of Defense.",On the Amendment,"(SENATE REJECTED WELLSTONE AMENDMENT NO. 2902, TO PROVIDE FUNDS FOR THE CHILD DEVELOPMENT PROGRAM OF THE DEPARTMENT OF DEFENSE. .)"
105,Senate,472,1998-06-25,2,174,48,45,0.747,-0.664,-0.045,-0.294,-59.139,S2057,Amendment Agreed to,"To modify the restrictions on the general authority of the Department of Defense regarding the closure and realignment of military installations, to express the sense of the Congress on further rounds of such closures and realignments, and for other purposes.",On the Amendment,"(SENATE AGREED TO INHOFE AMENDMENT NO. 2981, TO MODIFY THE RESTRICTIONS ON THE GENERAL AUTHORITY OF THE DEPARTMENT OF DEFENSE REGARDING THE CLOSURE AND REALIGNMENT OF MILITARY INSTALLATION, AND TO EXPRESS THE SENSE OF THE CONGRESS ON FURTHER ROUNDS OF SUCH CLOSURES AND REALIGNMENTS. .)"
105,Senate,473,1998-06-25,2,175,38,55,-0.143,-0.413,0.148,-0.159,-32.714,S2057,Amendment Rejected,To authorize a transfer of funds from the Department of Defense to the Department of Veterans Affairs for health care.,On the Amendment,"(SENATE REJECTED HARKIN AMENDMENT NO. 2982, TO AUTHORIZE A TRANSFER OF FUNDS FROM THE DEPARTMENT OF DEFENSE TO THE DEPARTMENT OF VETERANS AFFAIRS FOR HEALTH CARE. .)"
105,Senate,474,1998-06-25,2,176,45,49,0.04,-0.093,0.56,1.127,-10.103,S2057,Amendment Rejected,To repeal the restiction on use of Department of Defense facilities for abortions.,On the Amendment,"(SENATE REJECTED MURRAY AMENDMENT NO. 2794, TO REPEAL THE RESTRICTION ON THE USE OF DEPARTMENT OF DEFENSE FACILITIES FOR ABORTIONS. .)"
105,Senate,475,1998-06-25,2,177,49,44,-0.01,-0.569,-0.304,0.448,-10.981,S2057,Motion to Table Agreed to,"Relating to the withdrawal of lands at the Juniper Butte Range, Idaho, for use by the Secretary of the Air Force.",On the Motion to Table,"(SENATE TABLED REID AMENDMENT NO. 3009, RELATING TO THE WITHDRAWAL OF LANDS AT THE JUNIPER BUTTE RANGE, IDAHO, FOR USE BY THE SECRETARY OF THE AIR FORCE. .)"
105,Senate,476,1998-06-25,2,178,20,72,-0.311,-0.008,0.494,0.038,-20.836,S2057,Amendment Rejected,To terminate the Extremely Low Frequency Communication System program of the Navy.,On the Amendment,"(SENATE REJECTED FEINGOLD AMENDMENT NO. 2808, TO TERMINATE THE EXTREMELY LOW FREQUENCY COMMUNICATION SYSTEM PROGRAM OF THE NAVY. .)"
105,Senate,477,1998-06-25,2,179,19,73,-0.318,-0.323,0.133,0.217,-32.953,S2057,Amendment Rejected,To limit the obligation of advance procurement funds for the F-22 fighter.,On the Amendment,"(SENATE REJECTED BUMPERS AMENDMENT NO. 3012, TO LIMIT THE OBLIGATION OF ADVANCE PROCUREMENT FUNDS FOR THE F-22 AIRCRAFT PROGRAM. .)"
105,Senate,478,1998-06-25,2,180,39,54,-0.062,0.28,-0.087,-0.325,-46.57,S2057,Amendment Rejected,"To require seperate training platoons and seperate housing for male and female basic trainees, and to ensure after-hours privacy for basic trainees.",On the Amendment,"(SENATE REJECTED BYRD AMENDMENT NO. 3011 TO AMENDMENT NO. 3010, TO REQUIRE SEPARATE TRAINING PLATOONS AND SEPARATE HOUSING FOR MALE AND FEMALE BASIC TRAINEES, AND TO ENSURE AFTER-HOURS PRIVACY FOR BASIC TRAINEES. .)"
105,Senate,479,1998-06-25,2,181,88,4,-0.521,0.046,-1.189,-0.396,-9.854,S2057,Bill Passed,"An original bill to authorize appropriations for the fiscal year 1999 for military activities of the Department of Defense, for military construction, and for defense activities of the Department of Energy, to prescribe personnel strengths for such fiscal year for the Armed Forces, and for other purposes.",On Passage of the Bill,"(SENATE PASSED S. 2057, TO AUTHORIZE APPROPRIATIONS FOR FISCAL YEAR 1999 FOR MILITARY ACTIVITIES OF THE DEPARTMENT OF DEFENSE, FOR MILITARY CONSTRUCTION, AND FOR DEFENSE ACTIVITIES OF THE DEPARTMENT OF ENERGY, AND TO PRESCRIBE PERSONNEL STRENGTHS FOR SUCH FISCAL YEAR FOR THE ARMED FORCES. .)"
105,Senate,480,1998-06-26,2,182,86,0,0.0,0.0,0.0,0.0,0.0,PN744,Nomination Confirmed,"A. Howard Matz, of California, to be United States District Judge for the Central District of California vice Harry L. Hupp, retired",On the Nomination,"(SENATE CONFIRMED THE NOMINATION OF A. HOWARD MATZ, OF CALIFORNIA, TO BE UNITED STATES DISTRICT JUDGE FOR THE CENTRAL DISTRICT OF CALIFORNIA.)"
105,Senate,481,1998-06-26,2,183,86,0,0.0,0.0,0.0,0.0,0.0,PN503,Nomination Confirmed,"Victoria A. Roberts, of Michigan, to be United States District Judge for the Eastern District of Michigan vice George LaPlata, retired",On the Nomination,"(SENATE CONFIRMED THE NOMINATION OF VICTORIA A. ROBERTS, OF MICHIGAN, TO BE UNITED STATES DISTRICT JUDGE FOR THE EASTERN DISTRICT OF MICHIGAN.  .)"
105,Senate,482,1998-07-07,2,184,71,24,-0.298,-0.954,-0.152,0.0,-38.804,S648,Cloture Motion Agreed to,"A bill to establish legal standards and procedures for product liability litigation, and for other purposes.",On the Cloture Motion,"(THREE-FIFTHS OF THOSE SENATORS DULY CHOSEN AND SWORN VOTING IN THE AFFIRMATIVE, SENATE AGREED TO CLOSE FURTHER DEBATE ON THE MOTION TO PROCEED TO CONSIDERATION OF S. 648, THE PRODUCT LIABILITY REFORM ACT OF 1998. .)"
105,Senate,483,1998-07-07,2,185,33,66,0.27,-0.961,0.061,0.23,-53.763,S2168,Amendment Rejected,To terminate the Space Station and provide additional funding for veterans and low-income housing.,On the Amendment,"(SENATE REJECTED BUMPERS AMENDMENT NO. 3062, TO TERMINATE THE INTERNATIONAL SPACE STATION PROGRAM AND PROVIDE ADDITIONAL FUNDING FOR VETERANS AND LOW-INCOME HOUSING.)"
105,Senate,484,1998-07-08,2,186,76,22,-0.312,0.023,-0.278,0.183,-28.409,HR2676,Motion to Table Agreed to,"A bill to amend the Internal Revenue Code of 1986 to restructure and reform the Internal Revenue Service, and for other purposes.",On the Motion to Table,(SENATE TABLED THE MOTION TO APPEAL THE RULING OF THE CHAIR IN NOT SUSTAINING A POINT OF ORDER AGAINST THE CONFERENCE REPORT AS EXCEEDING THE SCOPE OF THE CONFERENCE WITH RESPECT TO CAPITAL GAINS REDUCTION.)
105,Senate,485,1998-07-08,2,187,50,48,0.025,1.0,-0.257,-0.012,-20.162,HR2676,Motion to Table Agreed to,"A bill to amend the Internal Revenue Code of 1986 to restructure and reform the Internal Revenue Service, and for other purposes.",On the Motion to Table,(SENATE TABLED THE MOTION TO APPEAL THE RULING OF THE CHAIR IN NOT SUSTAINING A POINT OF ORDER AGAINST THE CONFERENCE REPORT AS EXCEEDING THE SCOPE OF THE CONFERENCE WITH RESPECT TO VETERANS' SMOKING PROVISIONS.)
105,Senate,486,1998-07-09,2,188,51,47,0.104,-0.097,-0.318,0.569,-8.597,S648,Cloture Motion Rejected,In the nature of a substitute.,On the Cloture Motion,"(THREE-FIFTHS OF THOSE SENATORS DULY CHOSEN AND SWORN NOT HAVING VOTED IN THE AFFIRMATIVE, SENATE REJECTED THE MOTION TO INVOKE CLOTURE ON S. 648, A BILL TO ESTABLISH LEGAL STANDARDS AND PROCEDURES FOR PRODUCT LIABILITY LITIGATION, AND FOR OTHER PURPOSES./.)"
105,Senate,487,1998-07-09,2,189,97,2,0.0,0.0,0.0,0.0,0.0,HR2676,Conference Report Agreed to,"A bill to amend the Internal Revenue Code of 1986 to restructure and reform the Internal Revenue Service, and for other purposes.",On the Conference Report,"(SENATE AGREED TO THE CONFERENCE REPORT ACCOMPANYING H.R. 2676, TO AMEND THE INTERNAL REVENUE CODE OF 1986 TO RESTRUCTURE AND REFORM THE INTERNAL REVENUE SERVICE.)"
105,Senate,488,1998-07-09,2,190,98,0,0.0,0.0,0.0,0.0,0.0,S2282,Bill Passed,"A bill to amend the Arms Export Control Act, and for other purposes.",On Passage of the Bill,"(SENATE PASSED S. 2282, TO AMEND THE ARMS EXPORT CONTROL ACT.)"
105,Senate,489,1998-07-09,2,191,56,42,0.193,0.104,0.241,0.055,-20.061,S1882,Amendment Agreed to,To expand the educational opportunities for welfare recipients.,On the Amendment,"(SENATE AGREED TO THE WELLSTONE AMENDMENT NO. 3111, TO EXPAND THE EDUCATIONAL OPPORTUNITIES FOR WELFARE RECIPIENTS.)"
105,Senate,490,1998-07-09,2,192,39,58,-0.149,-0.241,0.294,-0.044,-15.866,S1882,Amendment Rejected,To provide for market-based determinations of lender returns.,On the Amendment,"(SENATE REJECTED THE KENNEDY AMENDMENT NO. 3119, TO PROVIDE FOR MARKET-BASED DETERMINATIONS OF LENDER RETURNS.)"
105,Senate,491,1998-07-09,2,193,23,74,-0.035,0.999,0.109,-0.198,-41.166,S1882,Amendment Rejected,To ensure that secondary school teachers are sufficiently prepared during their pre-service training to have sufficient academic knowledge to be able to help their students reach high academic standards.,On the Amendment,"(SENATE REJECTED THE BINGAMAN AMENDMENT NO. 3116, TO ENSURE THAT SECONDARY SCHOOL TEACHERS ARE SUFFICIENTLY PREPARED DURING THEIR PRE-SERVICE TRAINING TO HAVE SUFFICIENT ACADEMIC KNOWLEDGE TO BE ABLE TO HELP THEIR STUDENTS REACH HIGH ACADEMIC STANDARDS.)"
105,Senate,492,1998-07-09,2,194,41,56,-0.107,-0.994,0.286,-0.049,-16.372,S1882,Amendment Rejected,"To reduce student loan fees, and for other purposes.",On the Amendment,"(SENATE REJECTED THE HARKIN AMENDMENT NO. 3118, TO PROVIDE FOR REDUCTION IN STUDENT LOAN FEES.)"
105,Senate,493,1998-07-09,2,195,96,1,0.0,0.0,0.0,0.0,0.0,HR6,Bill Passed,"A bill to extend the authorization of programs under the Higher Education Act of 1965, and for other purposes.",On Passage of the Bill,"(SENATE PASSED H.R. 6, TO EXTEND THE AUTORIZATION OF PROGRAMS UNDER THE HIGHER EDUCATION ACT OF 1965.)"
105,Senate,494,1998-07-10,2,196,92,0,0.0,0.0,0.0,0.0,0.0,SCONRES107,Concurrent Resolution Agreed to,A concurrent resolution affirming U.S. commitments under the Taiwan Relations Act.,On the Concurrent Resolution,"(SENATE PASSED S. CON. RES. 107, A CONCURRENT RESOLUTION AFFIRMING UNITED STATES COMMITMENTS TO TAIWAN.)"
105,Senate,495,1998-07-13,2,197,52,43,-0.065,0.03,-0.284,-0.617,-18.534,S2271,Cloture Motion Rejected,"A bill to simplify and expedite access to the Federal courts for injured parties whose rights and privileges, secured by the United States Constitution, have been deprived by final actions of Federal agencies, or other government officials or entities acting under color of State law, and for other purposes.",On the Cloture Motion,"(THREE-FIFTHS OF THOSE SENATORS DULY CHOSEN AND SWORN NOT HAVING VOTED IN THE AFFIRMATIVE, SENATE REJECTED A MOTION TO CLOSE FURTHER DEBATE ON THE MOTION TO PROCEED TO CONSIDERATION OF S. 2271, THE PROPERTY RIGHTS IMPLEMENTATION ACT OF 1998.)"
105,Senate,496,1998-07-14,2,198,43,55,-0.003,-1.0,0.413,0.05,-6.815,S2159,Motion Rejected,Language identical to text of amendment No. 2714.,On the Motion,"(THREE-FIFTHS OF THOSE SENATORS DULY CHOSEN AND SWORN NOT HAVING VOTED IN THE AFFIRMATIVE, SENATE REJECTED A MOTION TO WAIVE THE CONGRESSIONAL BUDGET ACT WITH RESPECT TO CONSIDERATION OF  DASCHLE AMENDMENT NO. 2729, TO REFORM AND STRUCTURE THE PROCESSES BY WHICH TOBACCO PRODUCTS ARE MANUFACTURED, MARKETED, AND DISTRIBUTED, TO PREVENT THE USE OF TOBACCO PRODUCTS BY MINORS, AND TO REDRESS THE ADVERSE HEALTH EFFECTS OF TOBACCO USE. .)"
105,Senate,497,1998-07-14,2,199,99,0,0.0,0.0,0.0,0.0,0.0,S2159,Amendment Agreed to,To express the sense of the Senate that emergency action is necessary to respond to the economic hardships facing agricultural producers and their communities.,On the Amendment,"(SENATE AGREED TO THE HARKIN MODIFIED AMENDMENT NO. 3127, TO EXPRESS THE SENSE OF THE SENATE THAT EMERGENCY ACTION IS NECESSARY TO RESPOND TO THE ECONOMIC HARDSHIPS FACING AGRICULTURAL PRODUCERS AND THEIR COMMUNITIES. .)"
105,Senate,498,1998-07-15,2,200,56,43,-0.053,-0.195,-0.59,1.205,-1.517,S2159,Motion to Table Agreed to,To provide a safety net for farmers and consumers.,On the Motion to Table,"(SENATE TABLED DASCHLE AMENDMENT NO. 3146, TO PROVIDE A SAFETY NET FOR FARMERS AND CONSUMERS REGARDING MARKETING ASSISTANCE LOANS. .)"
105,Senate,499,1998-07-15,2,201,53,46,-0.612,0.791,0.021,0.101,-67.197,S2159,Motion to Table Agreed to,"To provide a framework for consideration by the legislative and executive branches of unilateral economic sanctions in order to ensure coordination of United States policy with respect to trade, security, and human rights.",On the Motion to Table,"(SEANTE TABLED LUGAR AMENDMENT NO. 3156, TO PROVIDE A FRAMEWORK FOR CONSIDERATION BY THE LEGISLATIVE AND EXECUTIVE BRANCHES OF UNILATERAL ECONOMIC SANCTIONS IN ORDER TO ENSURE COORDINATION OF UNITED STATES POLICY WITH RESPECT TO TRADE, SECURITY, AND HUMAN RIGHTS. .)"
105,Senate,500,1998-07-15,2,202,70,29,-0.629,0.778,-0.12,-0.181,-55.646,S2159,Motion to Table Agreed to,To eliminate funding for the market access program for fiscal year 1999.,On the Motion to Table,"(SENATE TABLED BRYAN AMENDMENT NO. 3157, TO ELIMINATE FUNDING FOR THE MARKET ACCESS  PROGRAM FOR FISCAL YEAR 1999. .)"
105,Senate,501,1998-07-15,2,203,38,60,-0.338,0.932,-0.044,-0.175,-60.471,S2159,Motion to Table Failed,"To exempt agricultural products, medicines and medical equipment from U.S. economic sanctions.",On the Motion to Table,"(SENATE FAILED TO TABLE DODD AMENDMENT NO. 3158, TO EXEMPT AGRICULTURAL PRODUCTS, MEDICINE, AND MEDICAL EQUIPMENT FROM U.S. ECONOMIC SANCTIONS. .)"
105,Senate,502,1998-07-15,2,204,30,67,-0.312,0.563,0.093,0.001,-51.593,S2159,Motion to Table Failed,To exclude the application of the amendment to certain countries.,On the Motion to Table,"(SENATE FAILED TO TABLE TORRICELLI AMENDMENT NO. 3160 TO AMENDMENT NO. 3158, TO EXCLUDE THE APPLICATION OF AMENDMENT NO. 3158 TO ANY COUNTRY THAT REPEATEDLY PROVIDED SUPPORT FOR ACTS OF TERRORISM. .)"
105,Senate,503,1998-07-15,2,205,49,49,-0.124,-0.992,-0.175,0.215,-31.88,S2159,Motion to Table Failed,To ensure the continued viability of livestock producers and the livestock industry in the United States.,On the Motion to Table,"(SENATE FAILED TO TABLE KERREY AMENDMENT NO. 3161, TO ENSURE THE CONTINUED VIABILITY OF  LIVESTOCK PRODUCERS AND THE LIVESTOCK INDUSTRY IN THE UNITED STATES.  .)"
105,Senate,504,1998-07-16,2,206,71,28,-0.559,-0.002,-0.067,-0.007,-56.034,S2159,Amendment Agreed to,To express the sense of the Senate concerning appropriate actions to be taken to alleviate the economic effect of low commodity prices.,On the Amendment,"(SENATE AGREED TO GRASSLEY AMENDMENT NO. 3172, TO EXPRESS THE SENSE OF THE SENATE CONCERNING APPROPRIATE ACTIONS TO BE TAKEN TO ALLEVIATE THE ECONOMIC EFFECT OF LOW COMMODITY PRICES.  .)"
105,Senate,505,1998-07-16,2,207,65,34,0.257,-0.019,0.165,0.446,-33.545,S2159,Amendment Agreed to,To provide funding for the Food Safety Initiative with an offset.,On the Amendment,"(SENATE AGREED TO HARKIN AMENDMENT NO. 3175, TO PROVIDE FUNDING FOR PROGRAMS OF THE FOOD SAFETY INITIATIVE.  .)"
105,Senate,506,1998-07-16,2,208,49,50,-0.094,0.359,0.218,0.363,-24.462,S2159,Motion Rejected,To provide for the conduct of anti-tobacco activities by the Food and Drug Administration.,On the Motion,"(THREE-FIFTHS OF THOSE SENATORS DULY CHOSEN AND SWORN NOT HAVING VOTED IN THE AFFIRMATIVE, SENATE  REJECTED A MOTION TO WAIVE THE CONGRESSIONAL BUDGET ACT WITH RESPECT TO CONSIDERATION OF HARKIN/REED AMENDMENT NO. 3193, TO PROVIDE ADDITIONAL FUNDING TO CONDUCT ANTI-TOBACCO ACTIVITIES BY THE FOOD AND DRUG ADMINISTRATION. .)"
105,Senate,507,1998-07-16,2,209,97,2,0.0,0.0,0.0,0.0,0.0,HR4101,Bill Passed,"A bill making appropriations for Agriculture, Rural Development, Food and Drug Administration, and Related Agencies programs for the fiscal year ending September 30, 1999, and for other purposes.",On Passage of the Bill,"(SENATE PASSED H.R. 4101, MAKING APPROPRIATIONS FOR AGRICULTURE, RURAL DEVELOPMENT, FOOD AND DRUG ADMINISTRATION, AND RELATED AGENCIES PROGRAMS FOR THE FISCAL YEAR ENDING SEPTEMBER 30, 1999. .)"
