congress,chamber,rollnumber,date,session,clerk_rollnumber,yea_count,nay_count,nominate_mid_1,nominate_mid_2,nominate_spread_1,nominate_spread_2,nominate_log_likelihood,bill_number,vote_result,vote_desc,vote_question,dtl_desc
114,Senate,396,2016-04-21,2,57,56,42,-0.034,-0.104,-0.372,-0.624,-4.482,HR2028,Amendment Rejected,To prohibit the use of funds relating to a certain definition.,On the Amendment,
114,Senate,397,2016-04-21,2,58,48,49,0.144,-0.109,-0.19,-0.121,-18.592,HR2028,Amendment Rejected,To limit the use of funds made available for the Advanced Technology Vehicles Manufacturing Loan Program.,On the Amendment,
114,Senate,398,2016-04-21,2,59,76,19,0.545,-0.137,0.194,-0.027,-33.723,HR2028,Amendment Agreed to,To provide funding for the Tribal Energy Loan Guarantee Program.,On the Amendment,
114,Senate,399,2016-04-25,2,60,55,38,0.338,-0.044,0.309,0.264,-16.977,HR2028,Amendment Agreed to,To add a provision relating to certain requirements in the acquisition of welded shipboard anchor and mooring chain.,On the Amendment,
114,Senate,400,2016-04-26,2,61,54,42,0.271,-0.08,0.155,0.101,-31.365,HR2028,Amendment Agreed to,To provide for funding for wind energy.,On the Amendment,
114,Senate,401,2016-04-26,2,62,73,23,0.49,0.042,0.194,0.201,-33.912,HR2028,Amendment Agreed to,To make funding for water management improvement subject to a condition.,On the Amendment,
114,Senate,402,2016-04-26,2,63,12,84,0.598,-0.325,-0.195,0.154,-25.314,HR2028,Amendment Rejected,To withhold certain funds for the construction of environmental infrastructure.,On the Amendment,
114,Senate,403,2016-04-27,2,64,50,46,0.031,-0.006,-0.136,-0.248,-27.927,HR2028,Cloture Motion Rejected,In the nature of a substitute.,On the Cloture Motion,
114,Senate,404,2016-04-28,2,65,52,43,0.0,-0.004,-0.145,-0.267,-25.107,HR2028,Cloture Motion Rejected,In the nature of a substitute.,On the Cloture Motion,
114,Senate,405,2016-05-09,2,66,50,42,0.0,-0.011,-0.168,-0.485,-19.225,HR2028,Cloture Motion Rejected,In the nature of a substitute.,On the Cloture Motion,
114,Senate,406,2016-05-11,2,67,57,42,-0.048,-0.048,-0.174,-0.325,-20.317,HR2028,Cloture Motion Rejected,Of a perfecting nature.,On the Cloture Motion,
114,Senate,407,2016-05-11,2,68,97,2,0.0,0.0,0.0,0.0,0.0,HR2028,Cloture Motion Agreed to,In the nature of a substitute.,On the Cloture Motion,
114,Senate,408,2016-05-11,2,69,39,60,-0.141,-0.101,0.381,0.061,-9.729,HR2028,Amendment Rejected,To use Federal and State expertise to mitigate fish and wildlife impacts at Corps of Engineers projects.,On the Amendment,
114,Senate,409,2016-05-11,2,70,51,48,0.109,-0.125,-0.194,-0.284,-18.582,HR2028,Amendment Rejected,To provide for the operation of reservoir projects by the Bureau of Reclamation.,On the Amendment,
114,Senate,410,2016-05-12,2,71,90,8,0.682,-0.171,0.288,-0.09,-12.454,HR2028,Bill Passed,"A bill making appropriations for energy and water development and related agencies for the fiscal year ending September 30, 2016, and for other purposes.",On Passage of the Bill,
114,Senate,411,2016-05-16,2,72,53,34,0.283,-0.046,0.22,0.243,-19.097,PN327,Nomination Confirmed,"Paula Xinis, of Maryland, to be United States District Judge for the District of Maryland",On the Nomination,
114,Senate,412,2016-05-17,2,73,50,47,0.163,-0.075,0.201,0.263,-16.465,HR2577,Cloture Motion Rejected,Making supplemental appropriations for fiscal year 2016 to respond to Zika virus.,On the Cloture Motion,
114,Senate,413,2016-05-17,2,74,52,45,0.037,-0.084,-0.454,0.172,-0.385,HR2577,Cloture Motion Rejected,"Making emergency supplemental appropriations for the fiscal year ending September 30, 2016, and for other purposes.",On the Cloture Motion,
114,Senate,414,2016-05-17,2,75,68,29,0.443,-0.059,0.338,0.147,-22.394,HR2577,Cloture Motion Agreed to,Zika response and preparedness.,On the Cloture Motion,
114,Senate,415,2016-05-19,2,76,70,28,0.458,-0.049,0.385,0.194,-20.209,HR2577,Motion Agreed to,Zika response and preparedness.,On the Motion,
114,Senate,416,2016-05-19,2,77,68,30,0.437,-0.07,0.358,0.025,-21.874,HR2577,Amendment Agreed to,Zika response and preparedness.,On the Amendment,
114,Senate,417,2016-05-19,2,78,88,10,0.648,-0.039,0.326,0.181,-14.397,HR2577,Cloture Motion Agreed to,In the nature of a substitute.,On the Cloture Motion,
114,Senate,418,2016-05-19,2,79,84,14,0.77,0.156,0.144,0.066,-37.074,HR2577,Motion Agreed to,To extend and expand eligibility for the Veterans Choice Program of the Department of Veterans Affairs and to establish consistent criteria and standards relating to the use of amounts under the Medical Community Care account of the Department of Veterans Affairs.,On the Motion,
114,Senate,419,2016-05-19,2,80,87,9,-0.458,-0.159,-0.319,0.003,-20.014,HR2577,Amendment Agreed to,To prohibit the use of funds to carry out a final rule and notice of the Department of Housing and Urban Development.,On the Amendment,
114,Senate,420,2016-05-19,2,81,60,37,0.38,-0.04,0.343,0.353,-18.335,HR2577,Motion to Table Agreed to,To prohibit the use of funds to carry out a rule and notice of the Department of Housing and Urban Development.,On the Motion to Table,
114,Senate,421,2016-05-19,2,82,89,8,0.683,0.027,0.264,0.227,-15.562,HR2577,Bill Passed,"A bill making appropriations for the Departments of Transportation, and Housing and Urban Development, and related agencies for the fiscal year ending September 30, 2016, and for other purposes.",On Passage of the Bill,
114,Senate,422,2016-05-23,2,83,89,0,0.0,0.0,0.0,0.0,0.0,S2613,Bill Passed,A bill to reauthorize certain programs established by the Adam Walsh Child Protection and Safety Act of 2006.,On Passage of the Bill,
114,Senate,423,2016-05-24,2,84,56,41,-0.067,-0.116,-0.379,-0.251,-6.303,HJRES88,Joint Resolution Passed,"A joint resolution disapproving the rule submitted by the Department of Labor relating to the definition of the term ""Fiduciary"".",On the Joint Resolution,
114,Senate,424,2016-05-24,2,85,57,40,0.141,0.155,0.011,0.272,-61.283,SJRES28,Motion to Proceed Agreed to,"A joint resolution providing for congressional disapproval under chapter 8 of title 5, United States Code, of the rule submitted by the Secretary of Agriculture relating to inspection of fish of the order Siluriformes.",On the Motion to Proceed,
114,Senate,425,2016-05-25,2,86,55,43,0.127,0.091,-0.0,0.274,-62.672193,SJRES28,Joint Resolution Passed,"A joint resolution providing for congressional disapproval under chapter 8 of title 5, United States Code, of the rule submitted by the Secretary of Agriculture relating to inspection of fish of the order Siluriformes.",On the Joint Resolution,
114,Senate,426,2016-05-25,2,87,98,0,0.0,0.0,0.0,0.0,0.0,S2943,Cloture on the Motion to Proceed Agreed to,"An original bill to authorize appropriations for fiscal year 2017 for military activities of the Department of Defense, for military construction, and for defense activities of the Department of Energy, to prescribe military personnel strengths for such fiscal year, and for other purposes.",On Cloture on the Motion to Proceed,
114,Senate,427,2016-05-26,2,88,67,29,0.449,-0.044,0.201,0.137,-32.396,PN771,Nomination Confirmed,"Laura S. H. Holgate, of Virginia, to be the Representative of the United States of America to the International Atomic Energy Agency, with the rank of Ambassador",On the Nomination,
114,Senate,428,2016-06-06,2,89,91,0,0.0,0.0,0.0,0.0,0.0,S2943,Amendment Agreed to,To modify the requirement that the Secretary of Defense implement measures to maintain the critical wartime medical readiness skills and core competencies of health care providers within the Armed Forces.,On the Amendment,
114,Senate,429,2016-06-07,2,90,66,32,0.423,-0.095,0.323,-0.08,-23.705,S2943,Amendment Agreed to,"To provide that certain provisions in this Act relating to limitations, transparency, and oversight regarding medical research conducted by the Department of Defense shall have mo force or effect.",On the Amendment,
114,Senate,430,2016-06-07,2,91,70,28,0.511,-0.297,0.114,-0.08,-45.918,S2943,Amendment Agreed to,To strike the provision relating to the pilot program on privatization of the Defense Commissary System.,On the Amendment,
114,Senate,431,2016-06-08,2,92,93,2,0.0,0.0,0.0,0.0,0.0,HR2577,Cloture Motion Agreed to,"A bill making appropriations for the Departments of Transportation, and Housing and Urban Development, and related agencies for the fiscal year ending September 30, 2016, and for other purposes.",On the Cloture Motion,
114,Senate,432,2016-06-08,2,93,46,49,0.142,-0.09,0.193,0.111,-16.438,HR2577,Motion Rejected,"A bill making appropriations for the Departments of Transportation, and Housing and Urban Development, and related agencies for the fiscal year ending September 30, 2016, and for other purposes.",On the Motion,
114,Senate,433,2016-06-08,2,94,56,38,-0.105,-0.127,-0.437,-0.234,-4.255,HR2577,Motion Rejected,"A bill making appropriations for the Departments of Transportation, and Housing and Urban Development, and related agencies for the fiscal year ending September 30, 2016, and for other purposes.",On the Motion,
114,Senate,434,2016-06-09,2,95,43,55,0.025,-0.089,0.208,0.248,-14.832,S2943,Cloture Motion Rejected,To authorize parity for defense and nondefense spending pursuant to the Bipartisan Budget Act of 2015.,On the Cloture Motion,
114,Senate,435,2016-06-09,2,96,56,42,-0.022,-0.151,-0.07,-0.333,-49.408,S2943,Cloture Motion Rejected,To address unfunded priorities of the Armed Forces.,On the Cloture Motion,
114,Senate,436,2016-06-10,2,97,68,23,-0.257,-0.263,-0.129,-0.429,-28.707,S2943,Cloture Motion Agreed to,"An original bill to authorize appropriations for fiscal year 2017 for military activities of the Department of Defense, for military construction, and for defense activities of the Department of Energy, to prescribe military personnel strengths for such fiscal year, and for other purposes.",On the Cloture Motion,
114,Senate,437,2016-06-14,2,98,85,13,0.082,0.997,-0.014,0.288,-35.12,S2943,Bill Passed,"An original bill to authorize appropriations for fiscal year 2017 for military activities of the Department of Defense, for military construction, and for defense activities of the Department of Energy, to prescribe military personnel strengths for such fiscal year, and for other purposes.",On Passage of the Bill,
114,Senate,438,2016-06-14,2,99,94,3,0.467,-0.884,0.11,-0.603,-15.421,HR2578,Cloture on the Motion to Proceed Agreed to,"A bill making appropriations for the Departments of Commerce and Justice, Science, and Related Agencies for the fiscal year ending September 30, 2016, and for other purposes.",On Cloture on the Motion to Proceed,
114,Senate,439,2016-06-16,2,100,95,1,0.0,0.0,0.0,0.0,0.0,S524,Cloture Motion Agreed to,"To authorize the Attorney General and Secretary of Health and Human Services to award grants to address the national epidemics of prescription opioid abuse and heroin use, and to provide for the establishment of an inter-agency task force to review, modify, and update best practices for pain management and prescribing pain medication, and for other purposes.",On the Cloture Motion,
114,Senate,440,2016-06-16,2,101,66,29,0.418,0.109,0.245,0.497,-26.85,S524,Motion Agreed to,"To authorize the Attorney General and Secretary of Health and Human Services to award grants to address the national epidemics of prescription opioid abuse and heroin use, and to provide for the establishment of an inter-agency task force to review, modify, and update best practices for pain management and prescribing pain medication, and for other purposes.",On the Motion,
114,Senate,441,2016-06-16,2,102,70,24,0.478,0.085,0.203,0.27,-31.525,S524,Motion Agreed to,"To authorize the Attorney General and Secretary of Health and Human Services to award grants to address the national epidemics of prescription opioid abuse and heroin use, and to provide for the establishment of an inter-agency task force to review, modify, and update best practices for pain management and prescribing pain medication, and for other purposes.",On the Motion,
114,Senate,442,2016-06-20,2,103,53,47,0.086,-0.084,-0.224,-0.245,-10.92,HR2578,Cloture Motion Rejected,To address gun violence and improve the availability of records to the National Instant Criminal Background Check System.,On the Cloture Motion,
114,Senate,443,2016-06-20,2,104,44,56,0.0,-0.093,0.297,0.545,-7.753,HR2578,Cloture Motion Rejected,"A bill making appropriations for the Departments of Commerce and Justice, Science, and Related Agencies for the fiscal year ending September 30, 2016, and for other purposes.",On the Cloture Motion,
114,Senate,444,2016-06-20,2,105,53,47,0.043,0.007,-0.258,-0.635,-9.401,HR2578,Cloture Motion Rejected,"To Secure our Homeland from radical Islamists by Enhancing Law enforcement Detection (""SHIELD"").",On the Cloture Motion,
114,Senate,445,2016-06-20,2,106,47,53,0.084,-0.097,0.281,0.495,-7.818,HR2578,Cloture Motion Rejected,To authorize the Attorney General to deny requests to transfer a firearm to known or suspected terrorists.,On the Cloture Motion,
114,Senate,446,2016-06-20,2,107,56,42,-0.072,-0.119,-0.403,-0.271,-5.234,HR2578,Motion to Table Agreed to,"A bill making appropriations for the Departments of Commerce and Justice, Science, and Related Agencies for the fiscal year ending September 30, 2016, and for other purposes.",On the Motion to Table,
114,Senate,447,2016-06-22,2,108,58,38,-0.075,-0.156,-0.096,-0.468,-37.901,HR2578,Cloture Motion Rejected,"To amend section 2709 of title 18, United States Code, to clarify that the Government may obtain a specified set of electronic communication transactional records under that section, and to make permanent the authority for individual terrorists to be treated as agents of foreign powers under the Foreign Intelligence Surveillance Act of 1978.",On the Cloture Motion,
114,Senate,448,2016-06-23,2,109,46,52,0.203,0.01,-0.221,-0.561,-18.056,HR2578,Motion to Table Failed,"A bill making appropriations for the Departments of Commerce and Justice, Science, and Related Agencies for the fiscal year ending September 30, 2016, and for other purposes.",On the Motion to Table,
114,Senate,449,2016-06-23,2,110,67,31,0.392,-0.509,0.1,-0.074,-51.24,HR2578,Motion to Table Agreed to,To authorize the Attorney General to delay or deny the transfer of firearms and explosives and issuance of Federal firearms and explosives licenses and permits to known or suspected terrorists.,On the Motion to Table,
114,Senate,450,2016-06-27,2,111,90,0,0.0,0.0,0.0,0.0,0.0,PN576,Nomination Confirmed,"Robert F. Rossiter, Jr., of Nebraska, to be United States District Judge for the District of Nebraska",On the Nomination,
114,Senate,451,2016-06-28,2,112,52,48,0.081,-0.095,-0.175,-0.017,-18.74,HR2577,Cloture Motion Rejected,"A bill making appropriations for the Departments of Transportation, and Housing and Urban Development, and related agencies for the fiscal year ending September 30, 2016, and for other purposes.",On the Cloture Motion,
114,Senate,452,2016-06-29,2,113,68,32,0.14,-0.481,0.012,-0.215,-64.059,S2328,Cloture Motion Agreed to,"A bill to reauthorize and amend the National Sea Grant College Program Act, and for other purposes.",On the Cloture Motion,
114,Senate,453,2016-06-29,2,114,44,54,-0.046,0.017,0.156,0.235,-21.569,S2328,Motion to Table Failed,"A bill to reauthorize and amend the National Sea Grant College Program Act, and for other purposes.",On the Motion to Table,
114,Senate,454,2016-06-29,2,115,85,13,-0.432,-0.349,-0.191,-0.377,-23.576,S2328,Motion Agreed to,"A bill to reauthorize and amend the National Sea Grant College Program Act, and for other purposes.",On the Motion,
114,Senate,455,2016-06-29,2,116,68,30,0.142,-0.752,0.013,-0.195,-59.116,S2328,Motion Agreed to,"A bill to reauthorize and amend the National Sea Grant College Program Act, and for other purposes.",On the Motion,
114,Senate,456,2016-06-29,2,117,68,29,-0.261,-0.218,-0.136,-0.239,-32.739,S764,Motion Agreed to,"A bill to reauthorize and amend the National Sea Grant College Program Act, and for other purposes.",On the Motion,
114,Senate,457,2016-07-06,2,118,92,5,0.533,0.509,0.217,0.716,-12.132,PN575,Nomination Confirmed,"Brian R. Martinotti, of New Jersey, to be United States District Judge for the District of New Jersey",On the Nomination,
114,Senate,458,2016-07-06,2,119,53,44,0.02,-0.082,-0.331,-0.549,-5.184,S3100,Cloture on the Motion to Proceed Rejected,A bill to ensure that State and local law enforcement may cooperate with Federal officials to protect our communities from violent criminals and suspected terrorists who are illegally present in the United States.,On Cloture on the Motion to Proceed,
114,Senate,459,2016-07-06,2,120,55,42,-0.062,-0.117,-0.448,-0.4,-2.614,S2193,Cloture on the Motion to Proceed Rejected,A bill to amend the Immigration and Nationality Act to increase penalties for individuals who illegally reenter the United States after being removed and for other purposes.,On Cloture on the Motion to Proceed,
114,Senate,460,2016-07-06,2,121,65,32,-0.203,-0.227,-0.109,-0.329,-37.878,S764,Cloture Motion Agreed to,"A bill to reauthorize and amend the National Sea Grant College Program Act, and for other purposes.",On the Cloture Motion,
114,Senate,461,2016-07-07,2,122,31,62,-0.224,-0.194,0.129,0.232,-34.063,S764,Motion to Table Failed,To change the enactment date.,On the Motion to Table,
114,Senate,462,2016-07-07,2,123,63,30,-0.146,-0.29,-0.071,-0.444,-41.904,S764,Motion Agreed to,"A bill to reauthorize and amend the National Sea Grant College Program Act, and for other purposes.",On the Motion,
114,Senate,463,2016-07-07,2,124,50,44,0.033,-0.075,-0.222,-0.162,-9.503,HR5293,Cloture on the Motion to Proceed Rejected,"A bill making appropriations for the Department of Defense for the fiscal year ending September 30, 2017, and for other purposes.",On Cloture on the Motion to Proceed,
114,Senate,464,2016-07-12,2,125,84,3,0.822,-0.143,0.429,0.116,-12.641,S2012,Cloture Motion Agreed to,"An original bill to provide for the modernization of the energy policy of the United States, and for other purposes.",On the Cloture Motion,
114,Senate,465,2016-07-13,2,126,90,2,0.0,0.0,0.0,0.0,0.0,S524,Cloture Motion Agreed to,"To authorize the Attorney General and Secretary of Health and Human Services to award grants to address the national epidemics of prescription opioid abuse and heroin use, and to provide for the establishment of an inter-agency task force to review, modify, and update best practices for pain management and prescribing pain medication, and for other purposes.",On the Cloture Motion,
114,Senate,466,2016-07-13,2,127,89,4,0.405,0.885,0.072,0.513,-17.544,HR636,Motion Agreed to,"An act to amend title 49, United States Code, to extend authorizations for the airport improvement program, to amend the Internal Revenue Code of 1986 to extend the funding and expenditure authority of the Airport and Airway Trust Fund, and for other purposes.",On the Motion,
114,Senate,467,2016-07-13,2,128,74,18,0.528,-0.378,0.175,-0.116,-31.586,PN1180,Nomination Confirmed,"Carla D. Hayden, of Maryland, to be Librarian of Congress for a term of ten years",On the Nomination,
114,Senate,468,2016-07-13,2,129,92,2,0.0,0.0,0.0,0.0,0.0,S524,Conference Report Agreed to,"To authorize the Attorney General and Secretary of Health and Human Services to award grants to address the national epidemics of prescription opioid abuse and heroin use, and to provide for the establishment of an inter-agency task force to review, modify, and update best practices for pain management and prescribing pain medication, and for other purposes.",On the Conference Report,
114,Senate,469,2016-07-14,2,130,90,7,-0.534,0.365,-0.194,0.216,-17.228,S2943,Cloture Motion Agreed to,"An original bill to authorize appropriations for fiscal year 2017 for military activities of the Department of Defense, for military construction, and for defense activities of the Department of Energy, to prescribe military personnel strengths for such fiscal year, and for other purposes.",On the Cloture Motion,
114,Senate,470,2016-07-14,2,131,84,12,0.606,0.092,0.236,0.404,-23.561,S2943,Motion Agreed to,"An original bill to authorize appropriations for fiscal year 2017 for military activities of the Department of Defense, for military construction, and for defense activities of the Department of Energy, to prescribe military personnel strengths for such fiscal year, and for other purposes.",On the Motion,
114,Senate,471,2016-07-14,2,132,85,12,-0.354,-0.576,-0.13,-0.456,-21.448,S2943,Motion Agreed to,"An original bill to authorize appropriations for fiscal year 2017 for military activities of the Department of Defense, for military construction, and for defense activities of the Department of Energy, to prescribe military personnel strengths for such fiscal year, and for other purposes.",On the Motion,
114,Senate,472,2016-07-14,2,133,55,42,-0.055,-0.107,-0.449,-0.236,-2.679,HR5293,Cloture on the Motion to Proceed Rejected,"A bill making appropriations for the Department of Defense for the fiscal year ending September 30, 2017, and for other purposes.",On Cloture on the Motion to Proceed,
114,Senate,473,2016-07-14,2,134,52,44,0.043,-0.107,-0.22,0.142,-10.387,HR2577,Cloture Motion Rejected,"A bill making appropriations for the Departments of Transportation, and Housing and Urban Development, and related agencies for the fiscal year ending September 30, 2016, and for other purposes.",On the Cloture Motion,
114,Senate,474,2016-09-06,2,135,52,46,0.053,-0.101,-0.184,-0.009,-15.49,HR2577,Cloture Motion Rejected,"A bill making appropriations for the Departments of Transportation, and Housing and Urban Development, and related agencies for the fiscal year ending September 30, 2016, and for other purposes.",On the Cloture Motion,
114,Senate,475,2016-09-06,2,136,55,43,-0.055,-0.112,-0.451,-0.238,-2.656,HR5293,Cloture on the Motion to Proceed Rejected,"A bill making appropriations for the Department of Defense for the fiscal year ending September 30, 2017, and for other purposes.",On Cloture on the Motion to Proceed,
114,Senate,476,2016-09-08,2,137,92,0,0.0,0.0,0.0,0.0,0.0,PN1500,Nomination Confirmed,"Peter Michael McKinley, of Virginia, to be Ambassador to the Federative Republic of Brazil",On the Nomination,
114,Senate,477,2016-09-12,2,138,90,1,0.0,0.0,0.0,0.0,0.0,S2848,Cloture Motion Agreed to,In the nature of a substitute.,On the Cloture Motion,
114,Senate,478,2016-09-14,2,139,85,12,0.669,-0.12,0.194,-0.035,-28.253,S2848,Motion Agreed to,In the nature of a substitute.,On the Motion,
114,Senate,479,2016-09-14,2,140,94,3,0.868,-0.252,0.464,-0.179,-3.899,S2848,Cloture Motion Agreed to,"A bill to provide for the conservation and development of water and related resources, to authorize the Secretary of the Army to construct various projects for improvements to rivers and harbors of the United States, and for other purposes.",On the Cloture Motion,
114,Senate,480,2016-09-15,2,141,95,3,0.868,-0.25,0.464,-0.177,-3.897,S2848,Bill Passed,"A bill to provide for the conservation and development of water and related resources, to authorize the Secretary of the Army to construct various projects for improvements to rivers and harbors of the United States, and for other purposes.",On Passage of the Bill,
114,Senate,481,2016-09-15,2,142,93,0,0.0,0.0,0.0,0.0,0.0,PN1375,Nomination Confirmed,"Susan S. Gibson, of Virginia, to be Inspector General of the National Reconnaissance Office",On the Nomination,
114,Senate,482,2016-09-19,2,143,89,0,0.0,0.0,0.0,0.0,0.0,HR5985,Bill Passed,"A bill to amend title 38, United States Code, to extend certain expiring provisions of law administered by the Secretary of Veterans Affairs, and for other purposes.",On Passage of the Bill,
114,Senate,483,2016-09-20,2,144,89,7,0.694,-0.233,0.323,-0.136,-12.835,HR5325,Cloture on the Motion to Proceed Agreed to,"A bill making appropriations for the Legislative Branch for the fiscal year ending September 30, 2017, and for other purposes.",On Cloture on the Motion to Proceed,
114,Senate,484,2016-09-21,2,145,71,27,-0.301,-0.343,-0.12,-0.211,-36.322,SJRES39,Motion to Table Agreed to,A joint resolution relating to the disapproval of the proposed foreign military sale to the Government of the Kingdom of Saudi Arabia of M1A1/A2 Abrams Tank structures and other major defense equipment.,On the Motion to Table,
114,Senate,485,2016-09-27,2,146,45,55,0.095,0.141,-0.091,-0.304,-44.557,HR5325,Cloture Motion Rejected,In the nature of a substitute.,On the Cloture Motion,
114,Senate,486,2016-09-27,2,147,40,59,0.264,-0.073,-0.106,-0.122,-43.776,HR5325,Cloture Motion Rejected,"A bill making appropriations for the Legislative Branch for the fiscal year ending September 30, 2017, and for other purposes.",On the Cloture Motion,
114,Senate,487,2016-09-28,2,148,97,1,0.0,0.0,0.0,0.0,0.0,S2040,Veto Overridden,"A bill to deter terrorism, provide justice for victims, and for other purposes.",On Overriding the Veto,
114,Senate,488,2016-09-28,2,149,77,21,0.293,-0.785,0.037,-0.282,-46.245,HR5325,Cloture Motion Agreed to,In the nature of a substitute.,On the Cloture Motion,
114,Senate,489,2016-09-28,2,150,77,21,0.293,-0.785,0.037,-0.282,-46.245,HR5325,Cloture Motion Agreed to,"A bill making appropriations for the Legislative Branch for the fiscal year ending September 30, 2017, and for other purposes.",On the Cloture Motion,
114,Senate,490,2016-09-28,2,151,72,26,0.211,-0.691,0.022,-0.271,-52.224,HR5325,Bill Passed,"A bill making appropriations for the Legislative Branch for the fiscal year ending September 30, 2017, and for other purposes.",On Passage of the Bill,
114,Senate,491,2016-11-15,2,152,97,0,0.0,0.0,0.0,0.0,0.0,HR4511,Bill Passed,A bill to amend the Veterans' Oral History Project Act to allow the collection of video and audio recordings of biographical histories by immediate family members of members of the Armed Forces who died as a result of their service during a period of war.,On Passage of the Bill,
