congress,chamber,rollnumber,date,session,clerk_rollnumber,yea_count,nay_count,nominate_mid_1,nominate_mid_2,nominate_spread_1,nominate_spread_2,nominate_log_likelihood,bill_number,vote_result,vote_desc,vote_question,dtl_desc
114,Senate,198,2015-06-02,1,198,42,56,0.23,-0.171,-0.114,0.017,-41.176,HR2048,Amendment Rejected,Of a perfecting nature.,On the Amendment,
114,Senate,199,2015-06-02,1,199,44,54,0.196,0.018,-0.108,-0.123,-40.688,HR2048,Amendment Rejected,Of a perfecting nature.,On the Amendment,
114,Senate,200,2015-06-02,1,200,43,56,0.2,0.048,-0.105,-0.161,-42.156,HR2048,Amendment Rejected,In the nature of a substitute.,On the Amendment,
114,Senate,201,2015-06-02,1,201,67,32,0.449,0.138,0.104,0.159,-48.57,HR2048,Bill Passed,"A bill to reform the authorities of the Federal Government to require the production of certain business records, conduct electronic surveillance, use pen registers and trap and trace devices, and use other forms of information gathering for foreign intelligence, counterterrorism, and criminal purposes, and for other purposes.",On Passage of the Bill,
114,Senate,202,2015-06-04,1,202,61,34,-0.179,-0.054,-0.229,0.184,-25.007,HR1735,Amendment Agreed to,"To provide additional amounts for procurement and for research, development, test, and evaluation for Stryker Lethality Upgrades, and to provide an offset.",On the Amendment,
114,Senate,203,2015-06-04,1,203,53,42,0.212,0.033,0.248,0.633,-14.696,HR1735,Amendment Rejected,To revise the definition of spouse for purposes of veterans benefits in recognition of new State definitions of spouse.,On the Amendment,
114,Senate,204,2015-06-04,1,204,48,44,0.075,-0.078,-0.181,0.198,-18.405,HR1735,Amendment Agreed to,To provide for the stationing of C-130 H aircraft avionics previously modified by the Avionics Modernization Program (AMP) in support of daily training and contingency requirements for Airborne and Special Operations Forces.,On the Amendment,
114,Senate,205,2015-06-09,1,205,46,51,0.037,-0.085,0.455,-0.169,-0.386,HR1735,Amendment Rejected,To limit the availability of amounts authorized to be appropriated for overseas contingency operations pending relief from the spending limits under the Budget Control Act of 2011.,On the Amendment,
114,Senate,206,2015-06-10,1,206,31,65,0.433,-0.037,-0.17,-0.225,-30.96,HR1735,Motion to Table Failed,To reauthorize and reform the Export-Import Bank of the United States.,On the Motion to Table,
114,Senate,207,2015-06-11,1,207,56,40,-0.115,0.017,-0.165,-0.414,-24.315,HR1735,Cloture Motion Rejected,To improve cybersecurity in the United States through enhanced sharing of information about cybersecurity threats.,On the Cloture Motion,
114,Senate,208,2015-06-15,1,208,62,24,0.351,0.134,0.257,0.833,-21.494,PN88,Nomination Confirmed,"Matthew T. McGuire, of the District of Columbia, to be United States Executive Director of the International Bank for Reconstruction and Development for a term of two years",On the Nomination,
114,Senate,209,2015-06-16,1,209,78,21,0.432,0.233,0.166,0.509,-32.245,HR1735,Amendment Agreed to,To reaffirm the prohibition on torture.,On the Amendment,
114,Senate,210,2015-06-16,1,210,54,45,0.007,-0.037,-0.104,0.04,-43.211,HR1735,Amendment Rejected,"To provide for a temporary, emergency authorization of defense articles, defense services, and related training directly to the Kurdistan Regional Government.",On the Amendment,
114,Senate,211,2015-06-16,1,211,50,49,0.092,-0.02,0.077,0.144,-50.005,HR1735,Amendment Rejected,To reform procedures for determinations to proceed to trial by court-martial for certain offenses under the Uniform Code of Military Justice.,On the Amendment,
114,Senate,212,2015-06-16,1,212,83,15,-0.516,0.223,-0.162,0.048,-30.421,HR1735,Cloture Motion Agreed to,In the nature of a substitute.,On the Cloture Motion,
114,Senate,213,2015-06-16,1,213,26,73,0.483,0.024,-0.162,-0.21,-38.178,HR1735,Amendment Rejected,"To limit the retirement of Army combat units, and to provide an offset.",On the Amendment,
114,Senate,214,2015-06-17,1,214,84,14,-0.438,0.05,-0.188,0.228,-28.087,HR1735,Cloture Motion Agreed to,"An act to authorize appropriations for fiscal year 2016 for military activities of the Department of Defense, for military construction, and for defense activities of the Department of Energy, to prescribe military personnel strengths for such fiscal year, and for other purposes.",On the Cloture Motion,
114,Senate,215,2015-06-18,1,215,71,25,-0.364,-0.221,-0.162,-0.065,-31.181,HR1735,Bill Passed,"An act to authorize appropriations for fiscal year 2016 for military activities of the Department of Defense, for military construction, and for defense activities of the Department of Energy, to prescribe military personnel strengths for such fiscal year, and for other purposes.",On Passage of the Bill,
114,Senate,216,2015-06-18,1,216,50,45,0.062,-0.093,-0.224,-0.018,-8.708,HR2685,Cloture on the Motion to Proceed Rejected,"A bill making appropriations for the Department of Defense for the fiscal year ending September 30, 2016, and for other purposes.",On Cloture on the Motion to Proceed,
114,Senate,217,2015-06-22,1,217,81,1,0.0,0.0,0.0,0.0,0.0,PN414,Nomination Confirmed,"Peter V. Neffenger, of Ohio, to be an Assistant Secretary of Homeland Security",On the Nomination,
114,Senate,218,2015-06-23,1,218,60,37,-0.187,-0.096,-0.125,0.084,-37.24,HR2146,Cloture Motion Agreed to,"A bill to amend the Internal Revenue Code of 1986 to allow Federal law enforcement officers, firefighters, and air traffic controllers to make penalty-free withdrawals from governmental plans after age 50, and for other purposes.",On the Cloture Motion,
114,Senate,219,2015-06-24,1,219,60,38,-0.182,-0.101,-0.126,0.086,-37.5,HR2146,Motion Agreed to,"A bill to amend the Internal Revenue Code of 1986 to allow Federal law enforcement officers, firefighters, and air traffic controllers to make penalty-free withdrawals from governmental plans after age 50, and for other purposes.",On the Motion,
114,Senate,220,2015-06-24,1,220,76,22,0.481,0.103,0.354,0.786,-20.503,HR1295,Cloture Motion Agreed to,"An act to extend the African Growth and Opportunity Act, the Generalized System of Preferences, the preferential duty treatment program for Haiti, and for other purposes.",On the Cloture Motion,
114,Senate,221,2015-07-07,1,221,95,0,0.0,0.0,0.0,0.0,0.0,PN12,Nomination Confirmed,"Kara Farnandez Stoll, of Virginia, to be United States Circuit Judge for the Federal Circuit",On the Nomination,
114,Senate,222,2015-07-08,1,222,98,0,0.0,0.0,0.0,0.0,0.0,S1177,Amendment Agreed to,To amend the Elementary and Secondary Education Act of 1965 regarding school librarians and effective school library programs.,On the Amendment,
114,Senate,223,2015-07-08,1,223,47,50,0.138,-0.077,0.219,0.153,-12.175,S1177,Amendment Rejected,"To amend section 1111(b)(2)(B)(xi) to provide for additional disaggregation for local educational agencies with a total of not less than 1,000 Asian and Native Hawaiian or Pacific Islander students.",On the Amendment,
114,Senate,224,2015-07-08,1,224,56,41,0.268,-0.127,0.159,-0.208,-35.717,S1177,Amendment Agreed to,To restore sections of the Elementary and Secondary Education Act of 1965.,On the Amendment,
114,Senate,225,2015-07-08,1,225,45,52,0.278,-0.072,-0.289,-0.125,-15.142,S1177,Amendment Rejected,"To allow States to let Federal funds for the education of disadvantaged children follow low-income children to the accredited or otherwise State-approved public school, private school, or supplemental educational services program they attend.",On the Amendment,
114,Senate,226,2015-07-09,1,226,44,54,0.312,-0.061,-0.44,-0.249,-10.324,S1177,Amendment Rejected,To allow a State to submit a declaration of intent to the Secretary of Education to combine certain funds to improve the academic achievement of students.,On the Amendment,
114,Senate,227,2015-07-09,1,227,98,0,0.0,0.0,0.0,0.0,0.0,S1177,Amendment Agreed to,To amend part A of title IV of the Elementary and Secondary Education Act of 1965 to allow funds provided under such part to be used for a site resource coordinator.,On the Amendment,
114,Senate,228,2015-07-09,1,228,98,0,0.0,0.0,0.0,0.0,0.0,S1177,Amendment Agreed to,"To ensure that States have policies or procedures that prohibit aiding or abetting of sexual abuse, and for other purposes.",On the Amendment,
114,Senate,229,2015-07-09,1,229,81,15,-0.617,-0.332,-0.153,-0.015,-32.069,HR1735,Cloture Motion Agreed to,"An act to authorize appropriations for fiscal year 2016 for military activities of the Department of Defense, for military construction, and for defense activities of the Department of Energy, to prescribe military personnel strengths for such fiscal year, and for other purposes.",On the Cloture Motion,
114,Senate,230,2015-07-09,1,230,44,52,0.001,-0.056,0.243,-0.333,-7.466,HR1735,Motion Rejected,"An act to authorize appropriations for fiscal year 2016 for military activities of the Department of Defense, for military construction, and for defense activities of the Department of Energy, to prescribe military personnel strengths for such fiscal year, and for other purposes.",On the Motion,
114,Senate,231,2015-07-13,1,231,89,0,0.0,0.0,0.0,0.0,0.0,S1177,Amendment Agreed to,To establish a committee on student privacy policy.,On the Amendment,
114,Senate,232,2015-07-14,1,232,45,51,0.259,-0.107,-0.324,0.229,-13.393,S1177,Amendment Rejected,To expand opportunity by allowing Title I funds to follow low-income children.,On the Amendment,
114,Senate,233,2015-07-14,1,233,56,40,0.308,-0.034,0.212,0.292,-21.477,S1177,Amendment Agreed to,To require a State's report card to include information on the graduation rates of homeless children and children in foster care.,On the Amendment,
114,Senate,234,2015-07-14,1,234,97,0,0.0,0.0,0.0,0.0,0.0,S1177,Amendment Agreed to,"To require local educational agencies to inform parents of any State or local educational agency policy, procedure, or parental right regarding student participation in any mandated assessments for that school year.",On the Amendment,
114,Senate,235,2015-07-14,1,235,32,64,0.402,0.011,-0.268,-0.365,-26.525,S1177,Amendment Rejected,To amend the Elementary and Secondary Education Act of 1965 relating to parental notification and opt-out of assessments.,On the Amendment,
114,Senate,236,2015-07-14,1,236,52,45,0.214,-0.033,0.261,0.609,-11.455,S1177,Amendment Rejected,To end discrimination based on actual or perceived sexual orientation or gender identity in public schools.,On the Amendment,
114,Senate,237,2015-07-15,1,237,86,12,0.592,0.148,0.317,0.628,-19.361,S1177,Cloture Motion Agreed to,In the nature of a substitute.,On the Cloture Motion,
114,Senate,238,2015-07-15,1,238,44,53,0.024,-0.107,0.269,0.658,-9.011,S1177,Amendment Rejected,To establish a climate change education program.,On the Amendment,
114,Senate,239,2015-07-15,1,239,58,39,0.319,-0.074,0.203,0.116,-25.3,S1177,Amendment Rejected,To reinstate grants to improve the mental health of children.,On the Amendment,
114,Senate,240,2015-07-15,1,240,46,50,0.099,-0.117,0.175,0.303,-20.057,S1177,Amendment Rejected,"To ensure that States measure and report on indicators of student access to critical educational resources and identify disparities in such resources, and for other purposes.",On the Amendment,
114,Senate,241,2015-07-15,1,241,43,54,-0.003,-0.093,0.213,-0.188,-14.361,S1177,Amendment Rejected,To amend the accountability provisions.,On the Amendment,
114,Senate,242,2015-07-16,1,242,40,58,0.318,0.015,-0.271,-0.53,-19.68,S1177,Amendment Rejected,"To provide for State-determined assessment and accountability systems, and for other purposes.",On the Amendment,
114,Senate,243,2015-07-16,1,243,43,55,-0.081,-0.099,0.42,-0.112,-3.815,S1177,Amendment Rejected,"To provide for youth jobs, and for other purposes.",On the Amendment,
114,Senate,244,2015-07-16,1,244,68,30,0.464,-0.117,0.124,-0.059,-47.473,S1177,Amendment Agreed to,To authorize the establishment of American Dream Accounts.,On the Amendment,
114,Senate,245,2015-07-16,1,245,59,39,-0.129,-0.245,-0.072,-0.059,-53.093,S1177,Amendment Agreed to,To amend the allocation of funds under subpart 2 of part A of title I of the Elementary and Secondary Education Act of 1965.,On the Amendment,
114,Senate,246,2015-07-16,1,246,53,44,0.255,-0.105,0.265,-0.213,-17.316,S1177,Amendment Agreed to,To amend title V of the Elementary and Secondary Education Act of 1965 to establish a full-service community schools grant program.,On the Amendment,
114,Senate,247,2015-07-16,1,247,45,52,0.035,-0.088,0.459,-0.161,-0.386,S1177,Amendment Rejected,"To establish a Federal-State partnership to provide access to high-quality public prekindergarten programs from low-income and moderate-income families to ensure that they enter kindergarten prepared for success, and for other purposes.",On the Amendment,
114,Senate,248,2015-07-16,1,248,79,18,0.297,0.846,0.037,0.257,-41.532,S1177,Cloture Motion Agreed to,An original bill to reauthorize the Elementary and Secondary Education Act of 1965 to ensure that every child achieves.,On the Cloture Motion,
114,Senate,249,2015-07-16,1,249,81,17,0.705,0.356,0.15,0.082,-31.805,S1177,Bill Passed,An original bill to reauthorize the Elementary and Secondary Education Act of 1965 to ensure that every child achieves.,On Passage of the Bill,
114,Senate,250,2015-07-21,1,250,41,56,0.24,-0.012,-0.12,-0.138,-37.011,HR22,Cloture on the Motion to Proceed Rejected,A bill to amend the Internal Revenue Code of 1986 to exempt employees with health coverage under TRICARE or the Veterans Administration from being taken into account for purposes of determining the employers to which the employer mandate applies under the Patient Protection and Affordable Care Act.,On Cloture on the Motion to Proceed,
114,Senate,251,2015-07-22,1,251,62,36,-0.194,-0.314,-0.092,-0.139,-44.289,HR22,Cloture on the Motion to Proceed Agreed to,A bill to amend the Internal Revenue Code of 1986 to exempt employees with health coverage under TRICARE or the Veterans Administration from being taken into account for purposes of determining the employers to which the employer mandate applies under the Patient Protection and Affordable Care Act.,On Cloture on the Motion to Proceed,
114,Senate,252,2015-07-24,1,252,51,26,-0.13,-0.462,-0.048,-0.217,-42.607,HR22,Motion to Proceed Agreed to,A bill to amend the Internal Revenue Code of 1986 to exempt employees with health coverage under TRICARE or the Veterans Administration from being taken into account for purposes of determining the employers to which the employer mandate applies under the Patient Protection and Affordable Care Act.,On the Motion to Proceed,
114,Senate,253,2015-07-26,1,253,49,43,0.043,-0.071,-0.449,0.163,-0.371,HR22,Cloture Motion Rejected,To repeal the Patient Protection and Affordable Care Act and the Health Care and Education Reconciliation Act of 2010 entirely.,On the Cloture Motion,
114,Senate,254,2015-07-26,1,254,67,26,0.458,0.02,0.27,0.325,-25.489,HR22,Cloture Motion Agreed to,To reauthorize and reform the Export-Import Bank of the United States.,On the Cloture Motion,
114,Senate,255,2015-07-27,1,255,79,14,0.499,-0.655,0.131,-0.212,-34.212,HR22,Motion for Attendance Agreed to,A bill to amend the Internal Revenue Code of 1986 to exempt employees with health coverage under TRICARE or the Veterans Administration from being taken into account for purposes of determining the employers to which the employer mandate applies under the Patient Protection and Affordable Care Act.,On the Motion for Attendance,
114,Senate,256,2015-07-27,1,256,64,29,0.44,-0.003,0.166,0.262,-30.233,HR22,Amendment Agreed to,To reauthorize and reform the Export-Import Bank of the United States.,On the Amendment,
114,Senate,257,2015-07-27,1,257,62,32,-0.179,0.167,-0.056,0.099,-54.381,HR22,Cloture Motion Agreed to,In the nature of a substitute.,On the Cloture Motion,
114,Senate,258,2015-07-29,1,258,62,38,-0.012,-0.328,-0.017,-0.162,-64.556,HR22,Amendment Agreed to,In the nature of a substitute.,On the Amendment,
114,Senate,259,2015-07-29,1,259,65,35,-0.135,-0.341,-0.038,-0.146,-60.493,HR22,Cloture Motion Agreed to,A bill to amend the Internal Revenue Code of 1986 to exempt employees with health coverage under TRICARE or the Veterans Administration from being taken into account for purposes of determining the employers to which the employer mandate applies under the Patient Protection and Affordable Care Act.,On the Cloture Motion,
114,Senate,260,2015-07-30,1,260,65,34,0.035,0.055,-0.014,0.055,-67.062,HR22,Bill Passed,"An act to authorize funds for Federal-aid highways, highway safety programs, and transit programs, and for other purposes.",On Passage of the Bill,
114,Senate,261,2015-07-30,1,261,91,4,0.862,-0.366,0.254,-0.083,-15.303,HR3236,Bill Passed,"A bill to provide an extension of Federal-aid highway, highway safety, motor carrier safety, transit, and other programs funded out of the Highway Trust Fund, to provide resource flexibility to the Department of Veterans Affairs for health care services, and for other purposes.",On Passage of the Bill,
114,Senate,262,2015-08-03,1,262,53,46,0.063,-0.085,-0.226,-0.343,-10.754,S1881,Cloture on the Motion to Proceed Rejected,A bill to prohibit Federal funding of Planned Parenthood Federation of America.,On Cloture on the Motion to Proceed,
114,Senate,263,2015-09-08,1,263,96,0,0.0,0.0,0.0,0.0,0.0,PN17,Nomination Confirmed,"Roseann A. Ketchmark, of Missouri, to be United States District Judge for the Western District of Missouri",On the Nomination,
114,Senate,264,2015-09-10,1,264,58,42,-0.064,-0.058,-0.244,0.296,-14.303,HJRES61,Cloture Motion Rejected,Of a perfecting nature.,On the Cloture Motion,
114,Senate,265,2015-09-15,1,265,56,42,-0.064,-0.058,-0.244,0.294,-14.298,HJRES61,Cloture Motion Rejected,Of a perfecting nature.,On the Cloture Motion,
114,Senate,266,2015-09-17,1,266,53,45,-0.03,-0.092,-0.45,-0.072,-1.778,HJRES61,Cloture Motion Rejected,"To prohibit the President from waiving, suspending, reducing, providing relief from, or otherwise limiting the application of sanctions pursuant to an agreement related to the nuclear program of Iran.",On the Cloture Motion,
114,Senate,267,2015-09-17,1,267,56,42,-0.064,-0.056,-0.244,0.294,-14.296,HJRES61,Cloture Motion Rejected,In the nature of a substitute.,On the Cloture Motion,
114,Senate,268,2015-09-22,1,268,54,42,0.044,-0.101,-0.282,-0.723,-7.309,HR36,Cloture on the Motion to Proceed Rejected,"A bill to amend title 18, United States Code, to protect pain-capable unborn children, and for other purposes.",On Cloture on the Motion to Proceed,
114,Senate,269,2015-09-22,1,269,54,42,-0.032,-0.095,-0.423,-0.087,-2.934,HR2685,Cloture on the Motion to Proceed Rejected,"A bill making appropriations for the Department of Defense for the fiscal year ending September 30, 2016, and for other purposes.",On Cloture on the Motion to Proceed,
114,Senate,270,2015-09-24,1,270,47,52,0.134,0.047,-0.187,-0.629,-19.959,HJRES61,Cloture Motion Rejected,"Making continuing appropriations for the fiscal year ending September 30, 2016, and for other purposes.",On the Cloture Motion,
114,Senate,271,2015-09-28,1,271,77,19,0.536,0.038,0.293,0.443,-24.506,HR719,Cloture Motion Agreed to,"A bill to require the Transportation Security Administration to conform to existing Federal law and regulations regarding criminal investigator positions, and for other purposes.",On the Cloture Motion,
114,Senate,272,2015-09-30,1,272,78,20,0.528,0.048,0.278,0.466,-26.427,HR719,Motion Agreed to,"A bill to require the Transportation Security Administration to conform to existing Federal law and regulations regarding criminal investigator positions, and for other purposes.",On the Motion,
114,Senate,273,2015-10-01,1,273,50,44,-0.03,-0.089,-0.425,-0.08,-2.958,HR2029,Cloture on the Motion to Proceed Rejected,"A bill making appropriations for military construction, the Department of Veterans Affairs, and related agencies for the fiscal year ending September 30, 2016, and for other purposes.",On Cloture on the Motion to Proceed,
114,Senate,274,2015-10-05,1,274,69,21,0.321,0.201,0.211,1.119,-18.67,PN14,Nomination Confirmed,"Dale A. Drozd, of California, to be United States District Judge for the Eastern District of California",On the Nomination,
114,Senate,275,2015-10-06,1,275,73,26,-0.311,-0.138,-0.205,-0.04,-29.791,HR1735,Cloture Motion Agreed to,"An act to authorize appropriations for fiscal year 2016 for military activities of the Department of Defense, for military construction, and for defense activities of the Department of Energy, to prescribe military personnel strengths for such fiscal year, and for other purposes.",On the Cloture Motion,
114,Senate,276,2015-10-07,1,276,71,26,-0.311,-0.138,-0.206,-0.042,-29.795,HR1735,Motion Agreed to,"An act to authorize appropriations for fiscal year 2016 for military activities of the Department of Defense, for military construction, and for defense activities of the Department of Energy, to prescribe military personnel strengths for such fiscal year, and for other purposes.",On the Motion,
114,Senate,277,2015-10-07,1,277,70,27,-0.334,-0.189,-0.16,-0.082,-32.69,HR1735,Conference Report Agreed to,"An act to authorize appropriations for fiscal year 2016 for military activities of the Department of Defense, for military construction, and for defense activities of the Department of Energy, to prescribe military personnel strengths for such fiscal year, and for other purposes.",On the Conference Report,
114,Senate,278,2015-10-08,1,278,49,47,0.091,-0.079,-0.186,-0.14,-16.418,HR2028,Cloture on the Motion to Proceed Rejected,"A bill making appropriations for energy and water development and related agencies for the fiscal year ending September 30, 2016, and for other purposes.",On Cloture on the Motion to Proceed,
114,Senate,279,2015-10-20,1,279,95,2,0.0,0.0,0.0,0.0,0.0,PN13,Nomination Confirmed,"Ann Donnelly, of New York, to be United States District Judge for the Eastern District of New York",On the Nomination,
114,Senate,280,2015-10-20,1,280,54,45,0.019,-0.083,-0.333,-0.555,-5.181,S2146,Cloture on the Motion to Proceed Rejected,"A bill to hold sanctuary jurisdictions accountable for defying Federal law, to increase penalties for individuals who illegally reenter the United States after being removed, and to provide liability protection for State and local law enforcement who cooperate with Federal law enforcement and for other purposes.",On Cloture on the Motion to Proceed,
114,Senate,281,2015-10-22,1,281,83,14,-0.432,-0.28,-0.246,-0.319,-22.511,S754,Cloture Motion Agreed to,In the nature of a substitute.,On the Cloture Motion,
114,Senate,282,2015-10-22,1,282,32,65,-0.124,-0.48,0.051,0.244,-49.595,S754,Amendment Rejected,To prohibit liability immunity to applying to private entities that break user or privacy agreements with customers.,On the Amendment,
114,Senate,283,2015-10-22,1,283,93,0,0.0,0.0,0.0,0.0,0.0,PN581,Nomination Confirmed,"Julie Furuta-Toy, of Wyoming, to be Ambassador to the Republic of Equatorial Guinea",On the Nomination,
114,Senate,284,2015-10-26,1,284,88,0,0.0,0.0,0.0,0.0,0.0,PN154,Nomination Confirmed,"Lawrence Joseph Vilardo, of New York, to be United States District Judge for the Western District of New York",On the Nomination,
114,Senate,285,2015-10-27,1,285,41,55,-0.083,-0.114,0.098,0.225,-39.514,S754,Amendment Rejected,To improve the requirements relating to removal of personal information from cyber threat indicators before sharing.,On the Amendment,
114,Senate,286,2015-10-27,1,286,47,49,0.036,-0.088,0.039,0.02,-61.746,S754,Amendment Rejected,To protect information that is reasonably believed to be personal information or information that identifies a specific person.,On the Amendment,
114,Senate,287,2015-10-27,1,287,37,59,-0.165,-0.112,0.124,0.256,-32.657,S754,Amendment Rejected,To strike the FOIA exemption.,On the Amendment,
114,Senate,288,2015-10-27,1,288,35,60,-0.198,-0.152,0.117,0.254,-34.068,S754,Amendment Rejected,To improve the definitions of cybersecurity threat and cyber threat indicator.,On the Amendment,
114,Senate,289,2015-10-27,1,289,41,54,-0.083,-0.102,0.088,0.349,-40.685,S754,Amendment Rejected,To modify section105 to require DHS to review all cyber threat indicators and countermeasures in order to remove certain personal information.,On the Amendment,
114,Senate,290,2015-10-27,1,290,22,73,0.57,-0.361,-0.133,-0.017,-42.956,S754,Amendment Rejected,To exempt from the capability and process within the Department of Homeland Security communication between a private entity and the Federal Bureau of Investigation or the United States Secret Service regarding cybersecurity threats.,On the Amendment,
114,Senate,291,2015-10-27,1,291,74,21,-0.456,-0.601,-0.097,-0.154,-41.341,S754,Bill Passed,"An original bill to improve cybersecurity in the United States through enhanced sharing of information about cybersecurity threats, and for other purposes.",On Passage of the Bill,
114,Senate,292,2015-10-30,1,292,63,35,0.4,-0.058,0.311,0.167,-22.369,HR1314,Cloture Motion Agreed to,A bill to amend the Internal Revenue Code of 1986 to provide for a right to an administrative appeal relating to adverse determinations of tax-exempt status of certain organizations.,On the Cloture Motion,
114,Senate,293,2015-10-30,1,293,64,35,0.4,-0.058,0.311,0.167,-22.369,HR1314,Motion Agreed to,A bill to amend the Internal Revenue Code of 1986 to provide for a right to an administrative appeal relating to adverse determinations of tax-exempt status of certain organizations.,On the Motion,
114,Senate,294,2015-10-30,1,294,64,35,0.4,-0.058,0.311,0.167,-22.369,HR1314,Motion Agreed to,A bill to amend the Internal Revenue Code of 1986 to provide for a right to an administrative appeal relating to adverse determinations of tax-exempt status of certain organizations.,On the Motion,
